id,label,left_index,left_id,left_title,left_authors,left_venue,left_year,right_index,right_id,right_title,right_authors,right_venue,right_year
89,0,2237,2364,materialized view selection and maintenance using multi-query optimization sigmod conference 2001,"krithi ramamritham , hoshi mistry , prasan roy , s. sudarshan",,,4326,1883,outerjoin simplification and reordering for query optimization acm transactions on database systems ( tods ),"c &#233; sar galindo-legaria , arnon rosenthal",,1997.0
90,0,1052,1106,adaptive algorithms for set containment joins acm trans . database syst .,"hector garcia-molina , sergey melnik",,2003.0,3372,929,"1-safe algorithms for symmetric site configurations rune humborstad , maitrayi sabaratnam , svein-olaf hvasshovd , &#216; ystein torbj &#248; rnsen 1997",,very large data bases,
91,0,893,942,book review column,karl aberer,sigmod record,2002.0,4573,2133,book reviews acm sigmod record,,,2003.0
92,0,1864,1972,binding propagation in disjunctive databases vldb 1998,sergio greco,,,4388,1945,tail recursion elimination in deductive databases acm transactions on database systems ( tods ),kenneth a. ross,,1996.0
93,0,567,598,krdb ' 98 : the 5th international workshop on knowledge representation meets databases 1998,"alexander borgida , martin staudt , vinay k. chaudhri",sigmod record,,4316,1873,"report on first international workshop on real-time database systems azer bestavros , kwei-jay lin , sang son",,acm sigmod record,1996.0
94,0,1213,1274,indexing very high-dimensional sparse and quasi-sparse vectors for similarity searches vldb j.,"xiaoyang sean wang , changzhou wang",,2001.0,3393,950,parallel algorithms for high-dimensional similarity joins for data mining applications very large data bases 1997,"john c. shafer , rakesh agrawal",,
95,0,779,821,towards on-line analytical mining in large databases jiawei han 1998,,sigmod record,,2565,94,turbo-charging vertical mining of large databases international conference on management of data 2000,"pradeep shenoy , jayant r. haritsa , s. sundarshan , gaurav bhalotia , mayank bawa , devavrat shah",,
96,0,403,420,dwms : data warehouse management system narendra mohan,,vldb,1996.0,2623,152,the araneus web-based management system international conference on management of data 1998,"g. mecca , p. atzeni , a. masci , g. sindoni , p. merialdo",,
97,0,2242,2371,editorial richard t. snodgrass 2001,,acm trans . database syst .,,4542,2101,"guest editorial amr el abbadi , gunter schlageter , kyu-young whang the vldb journal -- the international journal on very large data bases",,,2001.0
98,0,2422,2562,tracing the lineage of view data in a warehousing environment acm trans . database syst . 2000,"janet l. wiener , yingwei cui , jennifer widom",,,4560,2119,lineage tracing for general data warehouse transformations the vldb journal -- the international journal on very large data bases,"y. cui , j. widom",,2003.0
99,0,1683,1777,influence sets based on reverse nearest neighbor queries,"s. muthukrishnan , flip korn",sigmod conference,2000.0,4042,1599,"nearest neighbor queries nick roussopoulos , stephen kelley , fr &#233; d &#233; ric vincent international conference on management of data 1995",,,
100,0,656,692,repositories and object oriented databases philip a. bernstein,,sigmod record,1998.0,4091,1648,"metu object-oriented dbms asuman dogac , budak arpinar , cem evrendilek , cetin ozkan , ilker altintas , ilker durusoy , mehmet altinel , tansel okay , yuksel saygin international conference on management of data 1994",,,
101,0,482,507,"groupwise processing of relational queries kenneth a. ross , damianos chatziantoniou vldb",,,1997.0,2911,443,congressional samples for approximate answering of group-by queries international conference on management of data,"swarup acharya , phillip b. gibbons , viswanath poosala",,2000.0
102,0,982,1034,optimizing multi-feature queries for image databases vldb 2000,"ulrich güntzer , werner kießling , wolf-tilo balke",,,4401,1958,optimizing queries over multimedia repositories,"surajit chaudhuri , luis gravano",international conference on management of data,1996.0
103,0,1877,1985,static detection of security flaws in object-oriented databases keishi tajima sigmod conference 1996,,,,3679,1236,"description logics for semantic query optimization in object-oriented database systems domenico beneventano , sonia bergamaschi , claudio sartori acm transactions on database systems ( tods ) 2003",,,
104,0,1604,1692,the lyric language : querying constraint objects 1995,"alexander brodsky , yoram kornatzky",sigmod conference,,3096,638,"themis : a database programming language handling integrity constraints v &#233; ronique benzaken , anne doucet the vldb journal -- the international journal on very large data bases 1995",,,
105,1,2183,2309,actiview : adaptive data presentation using supersql vldb,"motomichi toyama , yoko maeda",,2001.0,4616,2179,"actiview : adaptive data presentation using supersql yoko maeda , motomichi toyama 2001",,very large data bases,
106,0,627,661,distance-based indexing for high-dimensional metric spaces sigmod conference,"z. meral özsoyoglu , tolga bozkaya",,1997.0,3487,1044,the x-tree : an index structure for high-dimensional data,"stefan berchtold , daniel a. keim , hans-peter kriegel",very large data bases,1996.0
107,0,1731,1829,efficiently instantiating view-objects from remote relational databases vldb j.,"gio wiederhold , byung suk lee",,1994.0,3329,879,efficiently publishing relational data as xml documents,"jayavel shanmugasundaram , eugene j. shekita , rimon barr , michael j. carey , bruce g. lindsay , hamid pirahesh , berthold reinwald",very large data bases,2000.0
108,1,996,1049,dbsim : a simulation tool for predicting database performance,"craig wong , mark stokrp , mike lefler",sigmod conference,1996.0,2713,242,dbsim : a simulation tool for predicting database performance international conference on management of data 1996,"mark lefler , mark stokrp , craig wong",,
109,0,152,156,report on the 8th international workshop on knowledge representation meets databases ( krdb ) 2001,"dan suciu , maurizio lenzerini , daniele nardi , werner nutt",sigmod record,,2948,480,report on ngits ' 99 : the fourth international workshop on next generation information technologies and systems opher etzion acm sigmod record 1999,,,
110,0,654,690,on supporting containment queries in relational database management systems sigmod conference 2001,"guy m. lohman , david j. dewitt , qiong luo , jeffrey f. naughton , chun zhang",,,3489,1046,"querying multiple features of groups in relational databases damianos chatziantoniou , kenneth a. ross 1996",,very large data bases,
111,0,2007,2125,efficient schemes for managing multiversionxml documents vldb j.,"shu-yao chien , carlo zaniolo , vassilis j. tsotras",,2002.0,3333,883,efficient filtering of xml documents for selective dissemination of information 2000,"mehmet altinel , michael j. franklin",very large data bases,
112,0,2256,2386,data extraction and transformation for the data warehouse cass squire sigmod conference,,,1995.0,3516,1073,data warehouse configuration very large data bases 1997,"dimitri theodoratos , timos k. sellis",,
113,0,1172,1232,weaving relations for cache performance vldb,"mark d. hill , anastassia ailamaki , david j. dewitt , marios skounakis",,2001.0,2713,242,dbsim : a simulation tool for predicting database performance international conference on management of data 1996,"mark lefler , mark stokrp , craig wong",,
114,0,1629,1721,"trex : dtd-conforming xml to xml transformations xueqing gong , kun yue , aoying zhou , zhimao guo , jianchang xiao , wenfei fan , hongwei wu , qing wang , shihui zheng sigmod conference 2003",,,,4491,2049,composing xsl transformations with xml publishing views international conference on management of data 2003,"chengkai li , philip bohannon , p. p. s. narayan",,
115,0,371,387,reminiscences on influential papers sigmod record,"kenneth a. ross , kyuseok shim , mary f. fernandez",,2002.0,2804,334,reminiscences in influential papers 1998,richard snodgrass,acm sigmod record,
116,0,630,665,"watermarking relational data : framework , algorithms and analysis vldb j.","peter j. haas , rakesh agrawal , jerry kiernan",,2003.0,4461,2019,a system for watermarking relational databases,"rakesh agrawal , peter j. haas , jerry kiernan",international conference on management of data,2003.0
117,0,1394,1469,report on the fourth international conference on flexible query answering systems,"gabriella pasi , amihai motro , patrick bosc",sigmod record,2001.0,4591,2154,report on fqas 2002 : fifth international conference on flexible query answering systems acm sigmod record 2003,"amihai motro , troels andreasen",,
118,1,40,40,why decision support fails and how to fix it sigmod record 1995,"kevin strehlo , ralph kimball",,,4001,1558,"why decision support fails and how to fix it ralph kimball , kevin strehlo",,acm sigmod record,1995.0
119,0,2256,2386,data extraction and transformation for the data warehouse cass squire sigmod conference,,,1995.0,4291,1848,"data warehousing and olap for decision support surajit chaudhuri , umeshwar dayal 1997",,international conference on management of data,
120,0,1049,1103,"workshop report : the first international workshop on active and real-time database systems ( artdb-95 ) mikael berndtsson , jörgen hansson sigmod record 1996",,,,2948,480,report on ngits ' 99 : the fourth international workshop on next generation information technologies and systems opher etzion acm sigmod record 1999,,,
121,0,2458,2601,reminiscences on influential papers sigmod record,"kaladhar voruganti , renée j. miller , kenneth a. ross , flip korn",,2002.0,2992,526,influential papers,ken ross,acm sigmod record,2002.0
122,0,1528,1610,discover : keyword search in relational databases 2002,"vagelis hristidis , yannis papakonstantinou",vldb,,3364,919,"data page layouts for relational databases on deep memory hierarchies anastassia ailamaki , david j. dewitt , mark d. hill the vldb journal -- the international journal on very large data bases 2002",,,
