id,label,left_index,left_id,left_title,left_authors,left_venue,left_year,right_index,right_id,right_title,right_authors,right_venue,right_year
0,0,1662,1756,web caching for database applications with oracle web cache,"jordan parker , jesse anton , zheng zeng , lawrence jacobs , tie zhong , xiang liu",sigmod conference,2002.0,3861,1418,form-based proxy caching for database-backed web sites very large data bases,"qiong luo , jeffrey f. naughton",,2001.0
1,0,210,217,oracle industrial exhibit 1998,amy pogue,vldb,,4574,2135,objectivity industrial exhibit objectivity very large data bases,,,1998.0
2,0,2339,2476,extracting large-scale knowledge bases from the web,"andrew tomkins , prabhakar raghavan , ravi kumar , sridhar rajagopalan",vldb,1999.0,3752,1309,amalgamating knowledge bases v. s. subrahmanian acm transactions on database systems ( tods ),,,1994.0
3,1,579,610,efficient optimistic concurrency control using loosely synchronized clocks sigmod conference,"barbara liskov , atul adya , robert gruber , umesh maheshwari",,1995.0,4038,1595,efficient optimistic concurrency control using loosely synchronized clocks,"atul adya , robert gruber , barbara liskov , umesh maheshwari",international conference on management of data,1995.0
4,0,2061,2183,"odefs : a file system interface to an object-oriented database narain h. gehani , william d. roome , h. v. jagadish vldb",,,1994.0,4073,1630,unisql/x unified relational and object-oriented database system won kim 1994,,international conference on management of data,
5,1,2438,2580,emergent semantics and the multimedia semantic web 2002,"william i. grosky , farshad fotouhi , d. v. sreenath",sigmod record,,3075,616,"emergent semantics and the multimedia semantic web w. i. grosky , d. v. sreenath , f. fotouhi",,acm sigmod record,2002.0
6,0,403,420,dwms : data warehouse management system narendra mohan,,vldb,1996.0,4309,1866,strudel : a web site management system 1997,"mary fernandez , daniela florescu , jaewoo kang , alon levy , dan suciu",international conference on management of data,
7,0,1463,1541,data mining techniques sigmod conference,jiawei han,,1996.0,3200,747,"data mining : concepts and techniques by jiawei han and micheline kamber fernando berzal , nicolf &#225; s mat &#237; n acm sigmod record",,,2002.0
8,0,1217,1278,"qursed : querying and reporting semistructured data yannis papakonstantinou , michalis petropoulos , vasilis vassalos sigmod conference 2002",,,,4242,1799,"extracting schema from semistructured data svetlozar nestorov , serge abiteboul , rajeev motwani 1998",,international conference on management of data,
9,0,1734,1832,advances in databases and information systems ( adbis ) 2002,"albertas caplinskas , johann eder , olegas vasilecas",sigmod record,,3356,910,"amicalola report : database and information systems research challenges and opportunities in semantic web and enterprises amit sheth , robert meersman acm sigmod record",,,2002.0
10,0,2108,2232,query unnesting in object-oriented databases leonidas fegaras 1998,,sigmod conference,,3565,1122,"calibrating the query optimizer cost model of iro-db , an object-oriented federated database system georges gardarin , fei sha , zhao-hui tang very large data bases",,,1996.0
11,1,1008,1061,"data management for pervasive computing mitch cherniack , stanley b. zdonik , michael j. franklin vldb",,,2001.0,3727,1284,"data management for pervasive computing mitch cherniack , michael j. franklin , stanley b. zdonik very large data bases 2001",,,
12,0,1420,1496,"secure transaction processing in firm real-time database systems binto george , jayant r. haritsa sigmod conference",,,1997.0,3113,658,"databases and transaction processing : an application-oriented approach philip m. lewis , arthur bernstein , michael kifer",,acm sigmod record,2002.0
13,0,1415,1491,declarative updates of relational databases,weidong chen,acm trans . database syst .,1995.0,3622,1179,enhanced abstract data types in object-relational databases,praveen seshadri,the vldb journal -- the international journal on very large data bases,1998.0
14,1,1385,1459,"a taxonomy for secure object-oriented databases sebastiaan h. von solms , martin s. olivier",,acm trans . database syst .,1994.0,3760,1317,a taxonomy for secure object-oriented databases,"martin s. olivier , sebastiaan h. von solms",acm transactions on database systems ( tods ),1994.0
15,0,1946,2061,"what is the data warehousing problem ? ( are materialized views the answer ? ) inderpal singh mumick , ashish gupta vldb 1996",,,,3515,1072,"algorithms for materialized view design in data warehousing environment jian yang , kamalakar karlapalem , qing li 1997",,very large data bases,
16,1,2326,2463,"enterprise objects framework , a second generation object-relational enabler charly kleissner sigmod conference 1995",,,,3989,1546,enterprise objects framework : a second generation object-relational enabler charly kleissner international conference on management of data 1995,,,
17,0,192,198,"effective timestamping in databases christian s. jensen , kristian torp , richard t. snodgrass vldb j. 2000",,,,3656,1213,"priority assignment in real-time active databases rajendran m. sivasankaran , john a. stankovic , don towsley , bhaskar purimetla , krithi ramamritham the vldb journal -- the international journal on very large data bases",,,1996.0
18,0,254,267,lambda-db : an odmg-based object-oriented dbms 2000,"arvind rajendran , david maier , leonidas fegaras , chandrasekhar srinivasan",sigmod conference,,4074,1631,odmg-93 : a standard for object-oriented dbmss r. g. g. cattell,,international conference on management of data,1994.0
19,1,491,516,"compressing sql workloads surajit chaudhuri , ashish kumar gupta , vivek r. narasayya sigmod conference",,,2002.0,3189,735,compressing sql workloads international conference on management of data,"surajit chaudhuri , ashish kumar gupta , vivek narasayya",,2002.0
20,0,970,1021,"the algres testbed of chimera : an active object-oriented database system giuseppe psaila , stefano ceri , stefano paraboschi , piero fraternali",,sigmod conference,1995.0,2696,225,the trigs active object-oriented database system - an overview,"g. kappel , w. retschitzegger",acm sigmod record,1998.0
21,1,1832,1938,on wrapping query languages and efficient xml integration sigmod conference,"jérôme siméon , vassilis christophides , sophie cluet",,2000.0,2544,73,"on wrapping query languages and efficient xml integration vassilis christophides , sophie cluet , j &#233; r &#466; me sim &#232; on 2000",,international conference on management of data,
22,0,1391,1466,document management as a database problem rudolf bayer 1995,,vldb,,3433,990,"is web-site management a database problem ? daniela florescu , alon y. levy , dan suciu very large data bases 1998",,,
23,0,1063,1118,"index nesting - an efficient approach to indexing in object-oriented databases jiawei han , beng chin ooi , hongjun lu , kian-lee tan",,vldb j.,1996.0,4358,1915,converting relational to object-oriented databases 1997,joseph fong,acm sigmod record,
24,1,1927,2038,controlling data warehouses with knowledge networks,"jan-dirk becker , matthias jarke , andreas boehmer , elvira schaefer",vldb,2000.0,3344,895,controlling data warehouses with knowledge networks very large data bases 2000,"elvira schaefer , jan-dirk becker , andreas boehmer , matthias jarke",,
25,0,158,162,temporal database system implementations michael h. böhlen 1995,,sigmod record,,3954,1511,temporal conditions and integrity constraints in active database systems international conference on management of data,"a. prasad sistla , ouri wolfson",,1995.0
26,1,592,624,ansi sql hierarchical processing can fully integrate native xml sigmod record,michael m. david,,2003.0,3365,920,ansi sql hierarchical processing can fully integrate native xml acm sigmod record 2003,michael m. david,,
27,1,2104,2227,"warping indexes with envelope transforms for query by humming dennis shasha , yunyue zhu",,sigmod conference,2003.0,4532,2091,"warping indexes with envelope transforms for query by humming yunyue zhu , dennis shasha",,international conference on management of data,2003.0
28,0,545,575,"reminiscences on influential papers theodore johnson , amr el abbadi , richard t. snodgrass , kenneth a. ross 2002",,sigmod record,,3107,650,influential papers ken ross acm sigmod record,,,2002.0
29,0,39,39,database research at ut arlington sigmod record 2003,"sharma chakravarthy , y. alp aslandogan , ramez elmasri , leonidas fegaras , jung-hwan oh",,,2794,323,database research at arizona state university,"susan d. urban , suzanne w. dietrich , forouzan golshani",acm sigmod record,1996.0
30,0,2101,2224,lore : a database management system for semistructured data sigmod record,"roy goldman , serge abiteboul , jennifer widom , dallan quass , jason mchugh",,1997.0,3494,1051,dwms : data warehouse management system narendra mohan very large data bases 1996,,,
31,0,1528,1610,discover : keyword search in relational databases 2002,"vagelis hristidis , yannis papakonstantinou",vldb,,4358,1915,converting relational to object-oriented databases 1997,joseph fong,acm sigmod record,
32,0,1701,1798,"incremental computation and maintenance of temporal aggregates jun yang , jennifer widom",,vldb j.,2003.0,2961,493,incremental maintenance of recursive views using relational calculus/sql,"guozhu dong , jianwen su",acm sigmod record,2000.0
33,0,357,373,"procedures in object-oriented query languages kazimierz subieta , jacek leszczylowski , yahiko kambayashi 1995",,vldb,,4676,2239,"an effective deductive object-oriented database through language integration maria l. barja , norman w. paton , alvaro a. a. fernandes , m. howard williams , andrew dinn very large data bases 1994",,,
34,1,160,164,opossum : desk-top schema management through customizable visualization vldb 1995,"miron livny , eben m. haber , yannis e. ioannidis",,,3910,1467,opossum : desk-top schema management through customizable visualization very large data bases,"eben m. haber , yannis e. ioannidis , miron livny",,1995.0
35,0,1087,1143,dms : a parallel data mining server felicity a. w. george,,vldb,1998.0,4255,1812,"scalable parallel data mining for association rules eui-hong han , george karypis , vipin kumar international conference on management of data",,,1997.0
36,1,1965,2081,"naos - efficient and modular reactive capabilities in an object-oriented database system thierry coupaye , t. svensen , christine collet",,vldb,1994.0,3862,1419,naos - efficient and modular reactive capabilities in an object-oriented database system 1994,"christine collet , thierry coupaye , t. svensen",very large data bases,
37,0,876,924,user-adaptive exploration of multidimensional data 2000,sunita sarawagi,vldb,,3469,1026,"a foundation for multi-dimensional databases marc gyssens , laks v. s. lakshmanan",,very large data bases,1997.0
38,1,1131,1189,"a query language for multidimensional arrays : design , implementation , and optimization techniques sigmod conference","limsoon wong , rona machlin , leonid libkin",,1996.0,4412,1969,"a query language for multidimensional arrays : design , implementation , and optimization techniques 1996","leonid libkin , rona machlin , limsoon wong",international conference on management of data,
39,1,316,331,"comprehension syntax limsoon wong , dan suciu , val tannen , peter buneman , leonid libkin sigmod record",,,1994.0,4144,1701,comprehension syntax,"peter buneman , leonid libkin , dan suciu , val tannen , limsoon wong",acm sigmod record,1994.0
40,0,1920,2031,buffering accesses to memory-resident index structures 2003,"jingren zhou , kenneth a. ross",vldb,,3851,1408,"efficient index structures for string databases tamer kahveci , ambuj k. singh 2001",,very large data bases,
41,0,1420,1496,"secure transaction processing in firm real-time database systems binto george , jayant r. haritsa sigmod conference",,,1997.0,4274,1831,revisiting commit processing in distributed database systems 1997,"ramesh gupta , jayant haritsa , krithi ramamritham",international conference on management of data,
42,0,132,135,semint : a system prototype for semantic integration in heterogeneous databases,"wen-syan li , chris clifton",sigmod conference,1995.0,3884,1441,a scalable architecture for autonomous heterogeneous database interactions very large data bases,"steven milliner , athman bouguettaya , mike p. papazoglou",,1995.0
43,0,1569,1656,"mining system audit data : opportunities and challenges wei fan , wenke lee 2001",,sigmod record,,3356,910,"amicalola report : database and information systems research challenges and opportunities in semantic web and enterprises amit sheth , robert meersman acm sigmod record",,,2002.0
44,0,1400,1475,"sit-in : a real-life spatio-temporal information system stefano de francisci , rossella molinaro , orietta gargano , mario paolucci , leonardo tininini , giuseppe sindoni , paola patteri , amedea ambrosetti , pina ticca , cristina bedeschi 2001",,vldb,,4352,1909,environmental information systems oliver g &#252; nther acm sigmod record,,,1997.0
45,0,1602,1690,"partial results for online query processing joseph m. hellerstein , vijayshankar raman sigmod conference",,,2002.0,4083,1640,"sequence query processing praveen seshadri , miron livny , raghu ramakrishnan",,international conference on management of data,1994.0
46,1,406,424,beyond market baskets : generalizing association rules to correlations,"rajeev motwani , sergey brin , craig silverstein",sigmod conference,1997.0,4256,1813,beyond market baskets : generalizing association rules to correlations international conference on management of data,"sergey brin , rajeev motwani , craig silverstein",,1997.0
47,0,2422,2562,tracing the lineage of view data in a warehousing environment acm trans . database syst . 2000,"janet l. wiener , yingwei cui , jennifer widom",,,3852,1409,"lineage tracing for general data warehouse transformations yingwei cui , jennifer widom very large data bases",,,2001.0
48,0,1032,1086,editorial vldb j.,"peter m. g. apers , stefano ceri , richard t. snodgrass",,2002.0,2812,342,editorial,richard snodgrass,acm transactions on database systems ( tods ),2001.0
49,0,2187,2313,"mining fuzzy association rules in databases ada wai-chee fu , man hon wong , chan man kuok sigmod record",,,1998.0,3485,1042,a new sql-like operator for mining association rules very large data bases,"rosa meo , giuseppe psaila , stefano ceri",,1996.0
50,0,776,817,"query optimization in the presence of limited access patterns dan suciu , ioana manolescu , daniela florescu , alon y. levy sigmod conference",,,1999.0,2727,256,"minimization of tree pattern queries sihem amer-yahia , sungran cho , laks v. s. lakshmanan , divesh srivastava 2001",,international conference on management of data,
51,0,369,385,query optimization for selections using bitmaps ming-chuan wu,,sigmod conference,1999.0,2775,304,query optimization in compressed database systems,"zhiyuan chen , johannes gehrke , flip korn",international conference on management of data,2001.0
52,0,1558,1645,"reminiscences on influential papers christos h. papadimitriou , anant jhingran , yannis e. ioannidis , kenneth a. ross sigmod record 2000",,,,3370,927,reminiscences on influential papers,kenneth a. ross,acm sigmod record,2003.0
53,1,734,774,user-defined table operators : enhancing extensibility for ordbms vldb 1999,"bernhard mitschang , michael jaedicke",,,3276,826,"user-defined table operators : enhancing extensibility for ordbms michael jaedicke , bernhard mitschang very large data bases 1999",,,
54,0,1626,1717,"distance browsing in spatial databases hanan samet , gísli r. hjaltason",,acm trans . database syst .,1999.0,2691,220,selectivity estimation in spatial databases,"swarup acharya , viswanath poosala , sridhar ramaswamy",international conference on management of data,1999.0
55,0,1168,1228,"answering xml queries on heterogeneous data sources ioana manolescu , donald kossmann , daniela florescu vldb",,,2001.0,3526,1083,describing and using query capabilities of heterogeneous sources,"vasilis vassalos , yannis papakonstantinou",very large data bases,1997.0
56,0,610,644,index configuration in object-oriented databases elisa bertino vldb j. 1994,,,,3922,1479,a cost model for clustered object-oriented databases very large data bases 1995,"georges gardarin , jean-robert gruser , zhao-hui tang",,
57,0,1103,1160,"reminiscences on influential papers z. meral özsoyoglu , philip s. yu , nick roussopoulos , krithi ramamritham , alberto o. mendelzon , richard t. snodgrass , laura m. haas , jennifer widom , jan paredaens sigmod record",,,1998.0,2992,526,influential papers,ken ross,acm sigmod record,2002.0
58,0,2458,2601,reminiscences on influential papers sigmod record,"kaladhar voruganti , renée j. miller , kenneth a. ross , flip korn",,2002.0,2697,226,reminiscences on influential papers richard snodgrass acm sigmod record 1998,,,
59,1,2284,2416,"filtering with approximate predicates hector garcia-molina , narayanan shivakumar , chandra chekuri 1998",,vldb,,3419,976,"filtering with approximate predicates narayanan shivakumar , hector garcia-molina , chandra chekuri 1998",,very large data bases,
60,0,1926,2037,sql query optimization : reordering for a general class of queries sigmod conference,"piyush goel , balakrishna r. iyer",,1996.0,3267,817,"probabilistic optimization of top n queries donko donjerkovic , raghu ramakrishnan very large data bases 1999",,,
61,1,423,441,"hierarchical compact cube for range-max queries hua-gang li , sin yeung lee , tok wang ling 2000",,vldb,,3806,1363,hierarchical compact cube for range-max queries 2000,"sin yeung lee , tok wang ling , hua-gang li",very large data bases,
62,0,610,644,index configuration in object-oriented databases elisa bertino vldb j. 1994,,,,3697,1254,opt + + : an object-oriented implementation for extensible database query optimization the vldb journal -- the international journal on very large data bases,"navin kabra , david j. dewitt",,1999.0
63,0,2063,2185,"further improvements on integrity constraint checking for stratifiable deductive databases sin yeung lee , tok wang ling vldb 1996",,,,4389,1946,"implementing deductive databases by mixed integer programming colin bell , anil nerode , raymond t. ng , v. s. subrahmanian",,acm transactions on database systems ( tods ),1996.0
64,0,105,107,hierarchical prefix cubes for range-sum queries vldb 1999,"chee yong chan , yannis e. ioannidis",,,3777,1334,dynamic update cube for range-sum queries very large data bases,"seok-ju chun , chin-wan chung , ju-hong lee , seok-lyong lee",,2001.0
65,0,2282,2414,hypergraph based reorderings of outer join queries with complex predicates sigmod conference 1995,"gautam bhargava , balakrishna r. iyer , piyush goel",,,4487,2045,factorizing complex predicates in queries to exploit indexes 2003,"surajit chaudhuri , prasanna ganesan , sunita sarawagi",international conference on management of data,
66,0,221,229,"the aditi deductive database system kotagiri ramamohanarao , david b. kemp , jayen vaghani , tim s. leask , james harland , peter j. stuckey , zoltan somogyi 1994",,vldb j.,,4052,1609,space optimization in deductive databases 1995,"divesh srivastava , s. sudarshan , raghu ramakrishnan , jeffrey f. naughton",acm transactions on database systems ( tods ),
67,0,1877,1985,static detection of security flaws in object-oriented databases keishi tajima sigmod conference 1996,,,,4073,1630,unisql/x unified relational and object-oriented database system won kim 1994,,international conference on management of data,
68,0,652,688,"strudel : a web-site management system alon y. levy , mary f. fernandez , jaewoo kang , daniela florescu , dan suciu 1997",,sigmod conference,,4381,1938,"using the calanda time series management system werner dreyer , angelika kotz dittrich , duri schmidt 1995",,international conference on management of data,
69,0,170,175,tree pattern query minimization,"divesh srivastava , sungran cho , laks v. s. lakshmanan , sihem amer-yahia",vldb j.,2002.0,3134,680,efficient algorithms for minimizing tree pattern queries prakash ramanan international conference on management of data 2002,,,
70,0,325,341,implementation of magic-sets in a relational database system sigmod conference,"inderpal singh mumick , hamid pirahesh",,1994.0,3272,822,on efficiently implementing schemasql on an sql database system,"laks v. s. lakshmanan , fereidoon sadri , subbu n. subramanian",very large data bases,1999.0
71,0,1453,1530,"a robust , optimization-based approach for approximate answering of aggregate queries 2001","vivek r. narasayya , gautam das , surajit chaudhuri",sigmod conference,,2497,26,"the aqua approximate query answering system swarup acharya , phillip b. gibbons , viswanath poosala , sridhar ramaswamy 1999",,international conference on management of data,
72,0,1435,1511,"selectivity estimation for spatio-temporal queries to moving objects yong-jin choi , chin-wan chung sigmod conference 2002",,,,2691,220,selectivity estimation in spatial databases,"swarup acharya , viswanath poosala , sridhar ramaswamy",international conference on management of data,1999.0
73,0,654,690,on supporting containment queries in relational database management systems sigmod conference 2001,"guy m. lohman , david j. dewitt , qiong luo , jeffrey f. naughton , chun zhang",,,4349,1906,integrating modelling systems for environmental management information systems 1997,"david j. abel , kerry taylor , dean kun",acm sigmod record,
74,0,1821,1927,"vist : a dynamic index method for querying xml data by tree structures wei fan , sanghyun park , philip s. yu , haixun wang sigmod conference 2003",,,,3851,1408,"efficient index structures for string databases tamer kahveci , ambuj k. singh 2001",,very large data bases,
75,0,2042,2162,foundations of preferences in database systems werner kießling 2002,,vldb,,3668,1225,secure buffering in firm real-time database systems 2000,"binto george , jayant r. haritsa",the vldb journal -- the international journal on very large data bases,
76,1,1060,1115,"towards automated performance tuning for complex workloads michael j. carey , manish mehta , miron livny , kurt p. brown",,vldb,1994.0,3868,1425,"towards automated performance tuning for complex workloads kurt p. brown , manish mehta , michael j. carey , miron livny 1994",,very large data bases,
77,0,1314,1380,book review column karl aberer,,sigmod record,2003.0,3198,745,book reviews acm sigmod record 2002,karl aberer,,
78,0,482,507,"groupwise processing of relational queries kenneth a. ross , damianos chatziantoniou vldb",,,1997.0,3506,1063,"cache conscious algorithms for relational query processing ambuj shatdal , chander kant , jeffrey f. naughton",,very large data bases,1994.0
79,0,1731,1829,efficiently instantiating view-objects from remote relational databases vldb j.,"gio wiederhold , byung suk lee",,1994.0,4358,1915,converting relational to object-oriented databases 1997,joseph fong,acm sigmod record,
80,0,276,289,"constructing the next 100 database management systems andreas geppert , klaus r. dittrich sigmod record",,,1994.0,4341,1898,the mariposa distributed database management system acm sigmod record,jeff sidell,,1996.0
81,0,20,20,report on the acm fourth international workshop on data warehousing and olap ( dolap 2001 ) joachim hammer sigmod record 2002,,,,2933,465,report on the fourth international conference on flexible query answering systems ( fqas 2000 ) acm sigmod record,"patrick bosc , amihai motro , gabriella pasi",,2001.0
82,0,371,387,reminiscences on influential papers sigmod record,"kenneth a. ross , kyuseok shim , mary f. fernandez",,2002.0,3107,650,influential papers ken ross acm sigmod record,,,2002.0
83,0,1063,1118,"index nesting - an efficient approach to indexing in object-oriented databases jiawei han , beng chin ooi , hongjun lu , kian-lee tan",,vldb j.,1996.0,3602,1159,exact : an extensible approach to active object-oriented databases,"oscar d &#237; az , arturo jaime",the vldb journal -- the international journal on very large data bases,1997.0
84,0,1191,1251,"mocha : a self-extensible database middleware system for distributed data sources manuel rodriguez-martinez , nick roussopoulos 2000",,sigmod conference,,2873,403,"aqr-toolkit : an adaptive query routing middleware for distributed data intensive systems ling liu , calton pu , david buttler , wei han , henrique paques , wei tang",,international conference on management of data,2000.0
85,0,340,356,"the design and implementation of a sequence database system raghu ramakrishnan , miron livny , praveen seshadri 1996",,vldb,,4337,1894,"the aggregate data problem : a system for their definition and management m. rafanelli , a. bezenchek , l. tininini 1996",,acm sigmod record,
86,0,21,21,approximating aggregate queries about web pages via random walks vldb 2000,"jittat fakcharoenphol , steve chien , ziv bar-yossef , alexander berg , dror weitz",,,2777,306,"a robust , optimization-based approach for approximate answering of aggregate queries 2001","surajit chaudhuri , gautam das , vivek narasayya",international conference on management of data,
87,0,1765,1866,databases and visualization,daniel a. keim,sigmod conference,1996.0,4297,1854,"delaunay : a database visualization system isabel f. cruz , m. averbuch , wendy t. lucas , melissa radzyminski , kirby zhang",,international conference on management of data,1997.0
88,0,529,557,closest pair queries in spatial databases 2000,"yannis theodoridis , yannis manolopoulos , antonio corral , michael vassilakopoulos",sigmod conference,,4497,2055,"location-based spatial queries jun zhang , manli zhu , dimitris papadias , yufei tao , dik lun lee 2003",,international conference on management of data,
