id,title,authors,venue,year
719,3d geographic network displays,"k cox , s eick , t he",sigmod record,1996.0
720,locally adaptive dimensionality reduction for indexing large time series databases sigmod conference,"e keogh , k chakrabarti , s mehrotra , m pazzani",,2001.0
721,applying database visualization to the world wide web,"m hasan , a mendelzon , d vista",sigmod record,1996.0
722,"a framework for information visualisation j kennedy , k mitchell , p barclay 1996",,sigmod record,
723,time series similarity measures and time series indexing 2001,,,
724,vqbd : exploring semistructured data sigmod conference,"s chawathe , t baby , j yeo",,2001.0
725,the aggregate data problem : a system for their definition and management,"m rafanelli , a bezenchek , l tininini",sigmod record,1996.0
726,models and languages for describing and discovering e-services,,,2001.0
727,"information visualization , guest editors ' foreword 1996",,,
728,lots o ' ticks : real-time high performance time series queries on billions of trades and quotes 2001,"a whitney , d shasha",sigmod conference,
729,editor 's notes jennifer widom sigmod record,,,1996.0
730,"in reply to domains , relations and religious wars h darwen sigmod record",,,1996.0
731,spatial data management for computer aided design sigmod conference 2001,"h kriegel , a mќller , m pіtke , t seidl",,
732,monitoring business processes through event correlation based on dependency model,"a adi , d botzer , o etzion , t yatzkar-haham",sigmod conference,2001.0
733,pixel-oriented database visualizations d keim sigmod record,,,1996.0
734,"minimization of tree pattern queries s amer-yahia , s cho , l lakshmanan , d srivastava",,sigmod conference,2001.0
735,"to table or not to table : a hypertabular answer g santucci , l tarantino",,sigmod record,1996.0
736,"using the golden rule of sampling for query estimation y wu , d agrawal , a abbadi",,sigmod conference,2001.0
737,incremental data structures and algorithms for dynamic query interfaces 1996,"e tanin , r beigel , b shneiderman",sigmod record,
738,on computing correlated aggregates over continual data streams 2001,"j gehrke , f korn , d srivastava",sigmod conference,
739,spotfire : an information exploration environment c ahlberg sigmod record 1996,,,
740,new standard for stored procedures in sql a eisenberg,,sigmod record,1996.0
741,"finding generalized projected clusters in high dimensional spaces c aggarwal , p yu",,sigmod conference,2000.0
742,"tcp-d - the challenges , issues and results r bhashyam sigmod record 1996",,,
743,density biased sampling : an improved method for data mining and clustering 2000,"c palmer , c faloutsos",sigmod conference,
744,high speed on-line backup when using logical log operations 2000,d lomet,sigmod conference,
745,report from the nsf workshop on workflow and process automation in information systems 1996,,,
746,the mariposa distributed database management system sigmod record,j sidell,,1996.0
747,efficient resumption of interrupted warehouse loads 2000,"w labio , j wiener , h garcia-molina , v gorelik",sigmod conference,
748,"domains , relations and religious wars r camps",,sigmod record,1996.0
749,the prototype of the dare system 2001,"t catarci , g santucci",sigmod conference,
750,"guidelines for presentation and comparison of indexing techniques j zobel , a moffat , k ramamohanarao 1996",,sigmod record,
751,pbir - perception-based image retrieval,"e chang , t cheng , l chang",sigmod conference,2001.0
752,will database researchers have any role in data security ? ( panel abstract ) 2001,a rosenthal,sigmod conference,
753,new programs at darpa and nsf sigmod record,x qian,,1996.0
754,monitoring xml data on the web,"b nguyen , s abiteboul , g cobena , m preda",sigmod conference,2001.0
755,editor 's notes j widom sigmod record 1996,,,
756,"finding replicated web collections j cho , n shivakumar , h garcia-molina",,sigmod conference,2000.0
757,"a comparison of three user interfaces to relational microcomputer data bases c medsker , m christensen , i song",,sigmod record,1995.0
758,efficient and cost-effective techniques for browsing and indexing large video databases,"j oh , k hua",sigmod conference,2000.0
759,editor 's ( farewell ) notes 1995,,,
760,efficient algorithms for mining outliers from large data sets 2000,"s ramaswamy , r rastogi , k shim",sigmod conference,
761,implementation aspects of an object-oriented dbms sigmod record 1995,"a dogac , m altinel , c ozkan , i durusoy",,
762,hodfa : an architectural framework for homogenizing heterogeneous legacy database sigmod record,"k karlapalem , q li , c shum",,1995.0
763,"designing and mining multi-terabyte astronomy archives : the sloan digital sky survey a szalay , p kunszt , a thakar , j gray , d slutz",,sigmod conference,2000.0
764,"approximating multi-dimensional aggregate range queries over real attributes d gunopulos , g kollios , v tsotras , c domeniconi 2000",,sigmod conference,
765,a close look at the ifo data model sigmod record,m hanna,,1995.0
766,an annotated bibliography of benchmarks for object databases sigmod record,a chaudhri,,1995.0
767,congressional samples for approximate answering of group-by queries,"s acharya , p gibbons , v poosala",sigmod conference,2000.0
768,"counting , enumerating , and sampling of execution plans in a cost-based query optimizer 2000","f waas , c galindo-legaria",sigmod conference,
769,an annotated bibliography on active databases sigmod record,"u jaeger , j freytag",,1995.0
770,"benchmarking queries over trees : learning the hard truth the hard way f wattez , s cluet , v benzaken , g ferran , c fiegel sigmod conference",,,2000.0
771,"acm multimedia '94 conference workshop on multimedia database management systems p berra , k nwosu , b thuraisingham 1995",,sigmod record,
772,answering complex sql queries using automatic summary tables sigmod conference,"m zaharioudakis , r cochrane , g lapis , h pirahesh , m urata",,2000.0
773,information finding in a digital library : the stanford perspective 1995,"t yan , h garcia-molina",sigmod record,
774,"turmoil at nasa , and numerous funding announcements x qian 1995",,sigmod record,
775,closest pair queries in spatial databases sigmod conference 2000,"a corral , y manolopoulos , y theodoridis , m vassilakopoulos",,
776,"efficient and extensible algorithms for multi query optimization p roy , s seshadri , s sudarshan , s bhobe",,sigmod conference,2000.0
777,"why decision support fails and how to fix it r kimball , k strehlo sigmod record 1995",,,
778,application of oodb and sgml techniques in text database : an electronic dictionary system j zhang sigmod record,,,1995.0
779,"eddies : continuously adaptive query processing r avnur , j hellerstein sigmod conference 2000",,,
780,normalization in oodb design b lee sigmod record 1995,,,
781,a chase too far ?,"l popa , a deutsch , a sahuguet , v tannen",sigmod conference,2000.0
782,"on the issue of valid time ( s ) in temporal databases s kokkotos , e ioannidis , t panayiotopoulos , c spyropoulos 1995",,sigmod record,
783,"a framework for expressing and combining preferences r agrawal , e wimmers sigmod conference",,,2000.0
784,addressing techniques used in database object managers o2 and orion,"a gamache , n sahraoui",sigmod record,1995.0
785,"a data model and data structures for moving objects databases l forlizzi , r gќting , e nardelli , m schneider",,sigmod conference,2000.0
786,metu interoperable database system sigmod record 1995,"a dogac , c dengi , e kilic , g жzhan , f ozcan , s nural , c evrendilek , u halici , i arpinar , p koksal , n kesim , s mancuhan",,
787,"adaptive multi-stage distance join processing h shin , b moon , s lee",,sigmod conference,2000.0
788,"aqr-toolkit : an adaptive query routing middleware for distributed data intensive systems l liu , c pu , d buttler , w han , h paques , w tang sigmod conference",,,2000.0
789,"metadata for digital media : introduction to the special issue w klas , a sheth sigmod record 1994",,,
790,\ are the terms \ '' \ `` version \ '' \ '' and \ '' \ `` variant \ '' \ '' orthogonal to one another ? a critical assessment of the step standardization \ '' '' sigmod record 1994,h wedekind,,
791,a goal-driven auto-configuration tool for the distributed workflow management system mentor-lite 2000,"m gillmann , j weiпenfels , g shegalov , w wonner , g weikum",sigmod conference,
792,"proceedings of the 2000 acm sigmod international conference on management of data , may 16-18 , 2000 , dallas , texas , usa",,,2000.0
793,"metadata in video databases r jain , a hampapur",,sigmod record,1994.0
794,metadata for multimedia documents sigmod record 1994,"k bіhm , t rakow",,
795,disima : a distributed and interoperable image database system,"v oria , m жzsu , p iglinski , s lin , b yao",sigmod conference,2000.0
796,data mining on an oltp system ( nearly ) for free 2000,"e riedel , c faloutsos , g ganger , d nagle",sigmod conference,
797,a new join algorithm sigmod record,"d shin , a meltzer",,1994.0
798,mining frequent patterns without candidate generation 2000,"j han , j pei , y yin",sigmod conference,
799,data modelling in the large m bertram sigmod record,,,1994.0
800,editor 's notes and erratum,,,1994.0
801,"on-line reorganization in object databases m lakhamraju , r rastogi , s seshadri , s sudarshan",,sigmod conference,2000.0
802,turbo-charging vertical mining of large databases,"p shenoy , j haritsa , s sudarshan , g bhalotia , m bawa , d shah",sigmod conference,2000.0
803,"a metadatabase system for semantic image search by a mathematical model of meaning y kiyoki , t kitagawa , t hayama sigmod record 1994",,,
804,"dlfm : a transactional resource manager h hsiao , i narang",,sigmod conference,2000.0
805,the database group at university of hagen ( fernuniversitaet ),"g schlageter , t berkel , e heuel , s mittrach , a scherer , w wilkes",sigmod record,1995.0
806,expressing business rules sigmod conference 2000,r ross,,
807,anatomy of a real e-commerce system a jhingran sigmod conference 2000,,,
808,calls for papers and announcements sigmod record,,,1995.0
809,handling very large databases with informix extended parallel server a weininger 2000,,sigmod conference,
810,fact : a learning based web query processing system,"s chen , y diao , h lu , z tian",sigmod conference,2000.0
811,implementing deletion in b + - trees,j jannink,sigmod record,1995.0
812,"multigranularity locking in multiple job classes transaction processing system s ng , s hung sigmod record 1995",,,
813,"an approximate search engine for structural databases j wang , x wang , d shasha , b shapiro , k zhang , x zheng , q ma , z weinberg 2000",,sigmod conference,
814,"concept based design of data warehouses : the dwq demonstrators m jarke , c quix , d calvanese , m lenzerini , e franconi , s ligoudistianos , p vassiliadis , y vassiliou sigmod conference 2000",,,
815,information systems research at rwth aachen 1995,m jarke,sigmod record,
816,ajax : an extensible data cleaning tool sigmod conference,"h galhardas , d florescu , d shasha , e simon",,2000.0
817,"the third manifesto h darwen , c date 1995",,sigmod record,
818,lh * rs : a high-availability scalable distributed data structure using reed solomon codes sigmod conference,"w litwin , t schwarz",,2000.0
819,"the database group at national technical university of athens ( ntua ) t sellis , y vassiliou 1995",,sigmod record,
820,"opportunities at arpa , nsf , and elsewhere",x qian,sigmod record,1995.0
821,wsq/dsq : a practical approach for combined querying of databases and the web sigmod conference 2000,"r goldman , j widom",,
822,parallelism and its price : a case study of nonstop sql/mp sigmod record 1995,"s englert , r glasstone , w hasan",,
823,mocha : a self-extensible database middleware system for distributed data sources 2000,"m rodriguez-martinez , n roussopoulos",sigmod conference,
824,"sql/cli - a new binding style for sql m venkatrao , m pizzo 1995",,sigmod record,
825,"towards self-tuning data placement in parallel database systems m lee , m kitsuregawa , b ooi , k tan , a mondal sigmod conference",,,2000.0
826,report on the 1995 international workshop on temporal databases 1995,,,
827,"webview materialization a labrinidis , n roussopoulos sigmod conference",,,2000.0
828,temporal database system implementations m bіhlen sigmod record,,,1995.0
829,"niagaracq : a scalable continuous query system for internet databases j chen , d dewitt , f tian , y wang sigmod conference 2000",,,
830,view maintenance in mobile computing sigmod record,"o wolfson , a sistla , s dao , k narayanan , r raj",,1995.0
831,terraserver : a spatial data warehouse 2000,"t barclay , d slutz , j gray",sigmod conference,
832,"indexing the positions of continuously moving objects s saltenis , c jensen , s leutenegger , m lopez sigmod conference",,,2000.0
833,managing video data in a mobile environment sigmod record,"r alonso , y chang , l iftode , v mani",,1995.0
834,how to roll a join : asynchronous incremental view maintenance,"k salem , k beyer , r cochrane , b lindsay",sigmod conference,2000.0
835,mobile computing and databases : anything new ?,"m dunham , a helal",sigmod record,1995.0
836,wireless client/server computing for personal information services and applications sigmod record 1995,"a elmagarmid , j jing , t furukawa",,
837,"on wrapping query languages and efficient xml integration v christophides , s cluet , j simщon sigmod conference 2000",,,
838,"data and knowledge base research at hong kong university of science and technology p drew , b hamidzadeh , k karlapalem , a kean , d lee , q li , f lochovsky , c shum , b wќthrich sigmod record 1995",,,
839,lof : identifying density-based local outliers sigmod conference,"m breunig , h kriegel , r ng , j sander",,2000.0
840,synchronizing a database to improve freshness 2000,"j cho , h garcia-molina",sigmod conference,
841,from the guest editors - special section on data management issues in mobile computing,"m dunham , a helal",,1995.0
842,digital library services in mobile computing 1995,"b bhargava , m annamalai , e pitoura",sigmod record,
843,"spatial join selectivity using power laws c faloutsos , b seeger , a traina , c jr. sigmod conference",,,2000.0
844,"influence sets based on reverse nearest neighbor queries f korn , s muthukrishnan sigmod conference",,,2000.0
845,an annotated bibliography on real-time database systems,ж ulusoy,sigmod record,1995.0
846,"xmill : an efficient compressor for xml data h liefke , d suciu sigmod conference 2000",,,
847,editor 's notes j widom sigmod record,,,1995.0
848,a research status report on adaptation for mobile data access,"b noble , m satyanarayanan",sigmod record,1995.0
849,xtract : a system for extracting document type descriptors from xml documents sigmod conference,"m garofalakis , a gionis , r rastogi , s seshadri , k shim",,2000.0
850,mapping extended entity relationship model to object modeling technique j fong,,sigmod record,1995.0
851,application architecture : 2tier or 3tier ? what is dbms 's role ? ( panel abstract ) 2000,a nori,sigmod conference,
852,index research : forest or trees ? ( panel abstract ),j hellerstein,sigmod conference,2000.0
853,"multi-table joins through bitmapped join indices p o'neil , g graefe sigmod record 1995",,,
854,"optimizing jan jannink 's implementation of b + - tree deletion r maelbrancke , h olivie 1995",,sigmod record,
855,from browsing to interacting : dbms support for responive websites ( abstract ) r ramakrishnan 2000,,sigmod conference,
856,"\ response to \ '' \ `` a close look at the ifo data model \ '' \ '' \ '' '' s abiteboul , r hull 1995",,sigmod record,
857,sqlem : fast clustering in sql using the em algorithm,"c ordonez , p cereghini",sigmod conference,2000.0
858,tutorial : data access,,,2000.0
859,condition handling in sql persistent stored modules j richey 1995,,sigmod record,
860,"data management research at the mitre corporation a rosenthal , l seligman , c mccollum , b blaustein , b thuraisingham , e lafferty",,sigmod record,1995.0
861,"data management in ecommerce : the good , the bad , and the ugly",,,2000.0
862,tutorial : designing an ultra highly available dbms,,,2000.0
863,"florida international university high performance database research center n rishe , w sun , d barton , y deng , c orji , m alexopoulos , l loureiro , c 0002 , m sanchez , a shaposhnikov",,sigmod record,1995.0
864,a framework for providing consistent and recoverable agent-based access to heterogeneous in mobile databases,"e pitoura , b bhargava",sigmod record,1995.0
865,on xml and databases : where 's the beef ? ( panel abstract ) 2000,m carey,sigmod conference,
866,making b + - trees cache conscious in main memory sigmod conference,"j rao , k ross",,2000.0
867,an introduction to remy 's fast polymorphic record projection sigmod record 1995,l wong,,
868,"an aspect of query optimization in multidatabase systems ( extended abstract ) c lee , c chen , h lu sigmod record",,,1995.0
869,"privacy-preserving data mining r agrawal , r srikant sigmod conference 2000",,,
870,design and user testing of a multi-paradigm query interface to an object-oriented database,"d doan , n paton , a kilgour",sigmod record,1995.0
871,"on effective multi-dimensional indexing for strings h jagadish , n koudas , d srivastava sigmod conference 2000",,,
872,editor 's notes 1995,j widom,sigmod record,
873,the onion technique : indexing for linear optimization queries 2000,"y chang , l bergman , v castelli , c li , m lo , j smith",sigmod conference,
874,internet traffic warehouse 2000,"c chen , m cochinwala , c petrone , m pucci , s samtani , p santa , m mesiti",sigmod conference,
875,calls for papers and announcements sigmod record,,,1995.0
876,"indexing images in oracle8i m annamalai , r chopra , s defazio sigmod conference",,,2000.0
877,the new middleware sigmod record,r finkelstein,,1995.0
878,"replication : db2 , oracle , or sybase ? d stacey sigmod record 1995",,,
879,online index rebuild 2000,"n ponnekanti , h kodavalla",sigmod conference,
880,maintenance of automatic summary tables sigmod conference,"w lehner , r sidle , h pirahesh , r cochrane",,2000.0
881,integrating replacement policies in storm : an extensible approach,"c goh , b ooi , s bressan , k tan",sigmod conference,2000.0
882,progress on hpcc and nii sigmod record,m winslett,,1994.0
883,the mlpq/gis constraint database system sigmod conference,"p revesz , r chen , p kanjamala , y li , y liu , y wang",,2000.0
884,efficient concurrency control in multidimensional access methods 1999,"k chakrabarti , s mehrotra",sigmod conference,
885,"analysis of predictive spatio-temporal queries y tao , j sun , d papadias 2003",,acm trans . database syst .,
886,"efficient dynamic mining of constrained frequent sets l lakshmanan , c leung , r ng 2003",,acm trans . database syst .,
887,"fast algorithms for projected clustering c aggarwal , c procopiuc , j wolf , p yu , j park 1999",,sigmod conference,
888,"image mining in iris : integrated retinal information system w hsu , m lee , k goh",,sigmod conference,2000.0
889,"effective page refresh policies for web crawlers j cho , h garcia-molina acm trans . database syst . 2003",,,
890,preference formulas in relational queries,j chomicki,acm trans . database syst .,2003.0
891,"mocha : a database middleware system featuring automatic deployment of application-specific functionality m rodriguez-martinez , n roussopoulos , j mcgann , s kelley , v katz , z song , j jсjс sigmod conference",,,2000.0
892,"tip : a temporal extension to informix j yang , h ying , j widom",,sigmod conference,2000.0
893,path sharing and predicate evaluation for high-performance xml filtering acm trans . database syst . 2003,"y diao , m altinel , m franklin , h zhang , p fischer",,
894,"spire : a progressive content-based spatial image retrieval engine c li , l bergman , v castelli , j smith 2000",,sigmod conference,
895,index-driven similarity search in metric spaces acm trans . database syst . 2003,"g hjaltason , h samet",,
896,homer : a model-based case tool for data-intensive web sites sigmod conference,"p merialdo , p atzeni , m magnante , g mecca , m pecorone",,2000.0
897,"research perspectives for time series management systems w dreyer , a dittrich , d schmidt",,sigmod record,1994.0
898,"supporting dynamic displays using active rules o dэaz , a jaime , n paton , g al-qaimari sigmod record",,,1994.0
899,javax.xxl : a prototype for a library of query processing algorithms,"j bercken , j dittrich , b seeger",sigmod conference,2000.0
900,overview of the special section on temporal database infrastructure 1994,r snodgrass,sigmod record,
901,"i3 : intelligent , interactive investigaton of olap data cubes 2000","s sarawagi , g sathe",sigmod conference,
902,"towards data mining benchmarking : a testbed for performance study of frequent pattern mining j pei , r mao , k hu , h zhu sigmod conference",,,2000.0
903,towards an infrastructure for temporal databases : report of an invitational arpa/nsf workshop 1994,,,
904,tutorial : ldap directory services - just another database application ?,,,2000.0
905,"tsql2 language specification r snodgrass , i ahn , g ariav , d batory , j clifford , c dyreson , r elmasri , f grandi , c jensen , w kфfer , n kline , k kulkarni , t leung , n lorentzos , j roddick , a segev , m soo , s sripada sigmod record",,,1994.0
906,text databases : a survey of text models and systems a loeffen sigmod record,,,1994.0
907,self-organizing data sharing communities with sagres,"z ives , a levy , j madhavan , r pottinger , s saroiu , i tatarinov , s betzler , q chen , e jaslikowska , j su , w yeung",sigmod conference,2000.0
908,the database research group at eth zurich,"m norrie , s blott , h schek , g weikum",sigmod record,1994.0
909,"lambda-db : an odmg-based object-oriented dbms l fegaras , c srinivasan , a rajendran , d maier",,sigmod conference,2000.0
910,influencing database language standards sigmod record,l gallagher,,1994.0
911,"serfing the web : web site management made easy e rundensteiner , k claypool , l chen , h su , k oenoki 2000",,sigmod conference,
912,computing capabilities of mediators sigmod conference,"r yerneni , c li , h garcia-molina , j ullman",,1999.0
913,understanding the global semantics of referential actions using logic rules,"w may , b ludфscher",acm trans . database syst .,2002.0
914,efficient geometry-based similarity search of 3d spatial databases sigmod conference,d keim,,1999.0
915,adaptive algorithms for set containment joins,"s melnik , h garcia-molina",acm trans . database syst .,2003.0
916,"a layered architecture for querying dynamic web content h davulcu , j freire , m kifer , i ramakrishnan 1999",,sigmod conference,
917,information management for genome level bioinformatics,,,2001.0
918,"silkroute : a framework for publishing relational data in xml m fernandez , y kadiyska , d suciu , a morishima , w tan 2002",,acm trans . database syst .,
919,"searching in metric spaces with user-defined and approximate distances p ciaccia , m patella acm trans . database syst .",,,2002.0
920,automatic discovery of language models for text databases,"j callan , m connell , a du",sigmod conference,1999.0
921,bottom-up computation of sparse and iceberg cubes sigmod conference 1999,"k beyer , r ramakrishnan",,
922,fast incremental maintenance of approximate histograms acm trans . database syst . 2002,"p gibbons , y matias , v poosala",,
923,"client-site query extensions t mayr , p seshadri",,sigmod conference,1999.0
924,searching for dependencies at multiple abstraction levels 2002,"t calders , r ng , j wijsen",acm trans . database syst .,
925,"a new method for similarity indexing of market basket data c aggarwal , j wolf , p yu",,sigmod conference,1999.0
926,locally adaptive dimensionality reduction for indexing large time series databases 2002,"k chakrabarti , e keogh , s mehrotra , m pazzani",acm trans . database syst .,
927,"cost models for overlapping and multiversion structures y tao , d papadias , j zhang",,acm trans . database syst .,2002.0
928,"dynamat : a dynamic view management system for data warehouses y kotidis , n roussopoulos sigmod conference 1999",,,
929,"an efficient bitmap encoding scheme for selection queries c chan , y ioannidis sigmod conference",,,1999.0
930,"iterative spatial join e jacox , h samet 2003",,acm trans . database syst .,
931,"approximate computation of multidimensional aggregates of sparse data using wavelets j vitter , m wang sigmod conference 1999",,,
932,removing permissions in the flexible authorization framework,"d wijesekera , s jajodia , f parisi-presicce , х hagstrіm",acm trans . database syst .,2003.0
933,an adaptive query execution system for data integration 1999,"z ives , d florescu , m friedman , a levy , d weld",sigmod conference,
934,"spatial queries in dynamic environments y tao , d papadias acm trans . database syst . 2003",,,
935,"a comparison of selectivity estimators for range queries on metric attributes b blohsfeld , d korus , b seeger sigmod conference",,,1999.0
936,are quorums an alternative for data replication ? acm trans . database syst . 2003,"r jimщnez-peris , m patiёo-martэnez , g alonso , b kemme",,
937,belief reasoning in mls deductive databases sigmod conference,h jamil,,1999.0
938,"on the computation of relational view complements j lechtenbіrger , g vossen acm trans . database syst . 2003",,,
939,discovering all most specific sentences acm trans . database syst . 2003,"d gunopulos , r khardon , h mannila , s saluja , h toivonen , r sharm",,
940,"efficient concurrency control for broadcast environments j shanmugasundaram , a nithrakashyap , r sivasankaran , k ramamritham",,sigmod conference,1999.0
941,a simple algorithm for finding frequent elements in streams and bags 2003,"r karp , s shenker , c papadimitriou",acm trans . database syst .,
942,"boat-optimistic decision tree construction j gehrke , v ganti , r ramakrishnan , w loh 1999",,sigmod conference,
