id,title,authors,venue,year
1370,"rethinking database system architecture : towards a self-tuning risc-style database system s chaudhuri , g weikum",,vldb,2000.0
1371,"the sr-tree : an index structure for high-dimensional nearest neighbor queries n katayama , s satoh sigmod conference",,,1997.0
1372,"wave-indices : indexing evolving databases n shivakumar , h garcia-molina sigmod conference",,,1997.0
1373,picodmbs : scaling down database techniques for the smartcard vldb,"c bobineau , l bouganim , p pucheral , p valduriez",,2000.0
1374,concurrency in the data warehouse,r taylor,vldb,2000.0
1375,revisiting commit processing in distributed database systems 1997,"r gupta , j haritsa , k ramamritham",sigmod conference,
1376,"lessons from wall street : case studies in configuration , tuning , and distribution ( tutorial ) 1997",,,
1377,temporal aggregation in active database rules sigmod conference 1997,"i motakis , c zaniolo",,
1378,"controlling data warehouses with knowledge networks e schaefer , j becker , a boehmer , m jarke vldb 2000",,,
1379,"secure transaction processing in firm real-time database systems b george , j haritsa",,sigmod conference,1997.0
1380,on efficiently implementing schemasql on an sql database system vldb,"l lakshmanan , f sadri , s subramanian",,1999.0
1381,the dangers of replication and a solution 1996,"j gray , p helland , p o'neil , d shasha",sigmod conference,
1382,"performance tradeoffs for client-server query processing m franklin , b jѓnsson , d kossmann sigmod conference 1996",,,
1383,"physical data independence , constraints , and optimization with universal plans vldb 1999","a deutsch , l popa , v tannen",,
1384,user-defined table operators : enhancing extensibility for ordbms vldb,"m jaedicke , b mitschang",,1999.0
1385,"random i/o scheduling in online tertiary storage systems b hillyer , a silberschatz 1996",,sigmod conference,
1386,"hot mirroring : a study to hide parity upgrade penalty and degradations during rebuilds for raid5 k mogi , m kitsuregawa sigmod conference 1996",,,
1387,"unrolling cycles to decide trigger termination s lee , t ling 1999",,vldb,
1388,on-line reorganization of sparsely-populated b + trees,"c zou , b salzberg",sigmod conference,1996.0
1389,similarity search in high dimensions via hashing vldb,"a gionis , p indyk , r motwani",,1999.0
1390,"optimal grid-clustering : towards breaking the curse of dimensionality in high-dimensional clustering a hinneburg , d keim vldb 1999",,,
1391,"birch : an efficient data clustering method for very large databases t zhang , r ramakrishnan , m livny sigmod conference 1996",,,
1392,"o-o , what have they done to db2 ?","m carey , d chamberlin , s narayanan , b vance , d doole , s rielau , r swagerman , n mattos",vldb,1999.0
1393,"query caching and optimization in distributed mediator systems s adali , k candan , y papakonstantinou , v subrahmanian sigmod conference",,,1996.0
1394,two techniques for on-line index modification in shared nothing parallel databases,"k achyutuni , e omiecinski , s navathe",sigmod conference,1996.0
1395,"what can hierarchies do for data warehouses ? h jagadish , l lakshmanan , d srivastava vldb",,,1999.0
1396,"relational databases for querying xml documents : limitations and opportunities j shanmugasundaram , k tufte , c zhang , g he , d dewitt , j naughton 1999",,vldb,
1397,rapid bushy join-order optimization with cartesian products sigmod conference 1996,"b vance , d maier",,
1398,performance measurements of compressed bitmap indices t johnson 1999,,vldb,
1399,objectivity industrial exhibit o objectivity vldb,,,1998.0
1400,idea : interactive data exploration and analysis sigmod conference,"p selfridge , d srivastava , l wilson",,1996.0
1401,"optimizing queries over multimedia repositories s chaudhuri , l gravano 1996",,sigmod conference,
1402,loading a cache with query results vldb,"l haas , d kossmann , i ursu",,1999.0
1403,"query optimization for xml j mchugh , j widom",,vldb,1999.0
1404,sql query optimization : reordering for a general class of queries sigmod conference 1996,"p goel , b iyer",,
1405,"probabilistic optimization of top n queries d donjerkovic , r ramakrishnan",,vldb,1999.0
1406,"bess : storage support for interactive visualization systems a biliris , t funkhouser , w o'connell , e panagos",,sigmod conference,1996.0
1407,multi-dimensional substring selectivity estimation,"h jagadish , o kapitskaia , r ng , d srivastava",vldb,1999.0
1408,capbased-ams : a capability-based and event-driven activity management system,"p hung , h yeung , k karlapalem",sigmod conference,1996.0
1409,quality-driven integration of heterogenous information systems 1999,"f naumann , u leser , j freytag",vldb,
1410,"data mining using two-dimensional optimized accociation rules : scheme , algorithms , and visualization 1996","t fukuda , y morimoto , s morishita , t tokuyama",sigmod conference,
1411,mining quantitative association rules in large relational tables sigmod conference,"r srikant , r agrawal",,1996.0
1412,"integrating heterogenous overlapping databases through object-oriented transformations v josifovski , t risch 1999",,vldb,
1413,issues in network management in the next millennium,"m brodie , s chaudhuri",vldb,1999.0
1414,databases and visualization,d keim,sigmod conference,1996.0
1415,networked data management design points j hamilton vldb,,,1999.0
1416,data mining techniques sigmod conference,j han,,1996.0
1417,dbsim : a simulation tool for predicting database performance 1996,"m lefler , m stokrp , c wong",sigmod conference,
1418,in cyber space no one can hear you scream vldb 1999,c pound,,
1419,dbminer : interactive mining of multiple-level knowledge in relational databases 1996,"j han , y fu , w wang , j chiang , o zaяane , k koperski",sigmod conference,
1420,"spirit : sequential pattern mining with regular expression constraints m garofalakis , r rastogi , k shim vldb 1999",,,
1421,"a framework for supporting data integration using the materialized and virtual approaches r hull , g zhou 1996",,sigmod conference,
1422,microsoft english query 7.5 : automatic extraction of semantics from relational databases and olap cubes vldb,a blum,,1999.0
1423,change detection in hierarchically structured information sigmod conference 1996,"s chawathe , a rajaraman , h garcia-molina , j widom",,
1424,"the new locking , logging , and recovery architecture of microsoft sql server 7.0 1999",d campbell,vldb,
1425,the value of merge-join and hash-join in sql server,g graefe,vldb,1999.0
1426,a query language and optimization techniques for unstructured data sigmod conference 1996,"p buneman , s davidson , g hillebrand , d suciu",,
1427,"voodb : a generic discrete-event random simulation model to evaluate the performances of oodbs j darmont , m schneider vldb",,,1999.0
1428,accessing relational databases from the world wide web sigmod conference 1996,"t nguyen , v srinivasan",,
1429,"goal-oriented buffer management revisited k brown , m carey , m livny",,sigmod conference,1996.0
1430,"building light-weight wrappers for legacy web data-sources using w4f a sahuguet , f azavant vldb 1999",,,
1431,"aqua : a fast decision support systems using approximate query answers s acharya , p gibbons , v poosala vldb 1999",,,
1432,"evaluating queries with generalized path expressions v christophides , s cluet , g moerkotte",,sigmod conference,1996.0
1433,repeating history beyond aries vldb,c mohan,,1999.0
1434,"cost-based optimization for magic : algebra and implementation p seshadri , j hellerstein , h pirahesh , t leung , r ramakrishnan , d srivastava , p stuckey , s sudarshan",,sigmod conference,1996.0
1435,online feedback for nested aggregate queries with multi-threading 1999,"k tan , c goh , b ooi",vldb,
1436,algorithms for deferred view maintenance sigmod conference,"l colby , t griffin , l libkin , i mumick , h trickey",,1996.0
1437,the persistent cache : improving oid indexing in temporal object-oriented database systems k nјrvхg vldb,,,1999.0
1438,"a query language for multidimensional arrays : design , implementation , and optimization techniques l libkin , r machlin , l wong sigmod conference",,,1996.0
1439,"mining deviants in a time series database h jagadish , n koudas , s muthukrishnan vldb 1999",,,
1440,a super scalar sort algorithm for risc processors sigmod conference,r agarwal,,1996.0
1441,histogram-based approximation of set-valued query-answers 1999,"y ioannidis , v poosala",vldb,
1442,bifocal sampling for skew-resistant join size estimation,"s ganguly , p gibbons , y matias , a silberschatz",sigmod conference,1996.0
1443,"semantic compression and pattern extraction with fascicles h jagadish , j madar , r ng vldb 1999",,,
1444,"estimating alphanumeric selectivity in the presence of wildcards p krishnan , j vitter , b iyer",,sigmod conference,1996.0
1445,adaptive parallel aggregation algorithms,"a shatdal , j naughton",sigmod conference,1995.0
1446,extending practical pre-aggregation in on-line analytical processing 1999,"t pedersen , c jensen , c dyreson",vldb,
1447,"aggregation algorithms for very large compressed data warehouses j li , d rotem , j srivastava vldb",,,1999.0
1448,a general solution of the n-dimensional b-tree problem 1995,m freeston,sigmod conference,
1449,extracting large-scale knowledge bases from the web 1999,"r kumar , p raghavan , s rajagopalan , a tomkins",vldb,
1450,"efficient optimistic concurrency control using loosely synchronized clocks a adya , r gruber , b liskov , u maheshwari",,sigmod conference,1995.0
1451,"data-driven , one-to-one web site generation for data-intensive applications 1999","s ceri , p fraternali , s paraboschi",vldb,
1452,a critique of ansi sql isolation levels sigmod conference,"h berenson , p bernstein , j gray , j melton , e o'neil , p o'neil",,1995.0
1453,"the garlic project m roth , m arya , l haas , m carey , w cody , r fagin , p schwarz , j ii , e wimmers sigmod conference",,,1996.0
1454,"curio : a novel solution for efficient storage and indexing in data warehouses a datta , k ramamritham , h thomas",,vldb,1999.0
1455,"datawarehousing has more colours than just black & white t zurek , m sinnwell vldb 1999",,,
1456,"the multiview project : object-oriented view technology and applications e rundensteiner , h kuno , y ra , v crestana-taube , m jones , p marrѓn sigmod conference",,,1996.0
1457,sonar : system for optimized numeric associationrules sigmod conference 1996,"t fukuda , y morimoto , s morishita , t tokuyama",,
1458,high-performance extensible indexing m kornacker,,vldb,1999.0
1459,"metu interoperable database system a dogac , u halici , e kilic , g жzhan , f ozcan , s nural , c dengi , s mancuhan , i arpinar , p koksal , c evrendilek sigmod conference 1996",,,
1460,hierarchical prefix cubes for range-sum queries vldb 1999,"c chan , y ioannidis",,
1461,"prospector : a content-based multimedia server for massively parallel architectures s choo , w o'connell , g linderman , h chen , k ganapathi , a biliris , e panagos , d schrader sigmod conference 1996",,,
1462,combining histograms and parametric curve fitting for feedback-driven query result-size estimation,"a kіnig , g weikum",vldb,1999.0
1463,"lore : a lightweight object repository for semistructured data d quass , j widom , r goldman , k haas , q luo , j mchugh , s nestorov , a rajaraman , h rivero , s abiteboul , j ullman , j wiener 1996",,sigmod conference,
1464,"evaluating top-k selection queries s chaudhuri , l gravano 1999",,vldb,
1465,hyperstorm - administering structured documents using object-oriented database technology,"k bіhm , k aberer",sigmod conference,1996.0
1466,"distributed hypertext resource discovery through examples s chakrabarti , m berg , b dom 1999",,vldb,
1467,thinksheet : a tool for tailoring complex documents sigmod conference,"p piatko , r yangarber , d lin , d shasha",,1996.0
1468,"building hierarchical classifiers using class proximity k wang , s zhou , s liew 1999",,vldb,
1469,"active storage hierarchy , database systems and applications - socratic exegesis f cariёo , w o'connell , j burgess , j saltz 1999",,vldb,
1470,state of the art in workflow management research and products 1996,,,
1471,repository system engineering,,,1996.0
1472,"cost models do matter : providing cost information for diverse data sources in a federated system m roth , f ozcan , l haas vldb",,,1999.0
1473,generating call-level interfaces for advanced database application programming vldb 1999,"u nink , t hфrder , n ritter",,
1474,the ins and outs ( and everthing in between ) of data warehousing 1996,,,
1475,"high level indexing of user-defined types w chen , j chow , y fuh , j grandbois , m jou , n mattos , b tran , y wang 1999",,vldb,
1476,"is gui programming a database research problem ? n goyal , c hoch , r krishnamurthy , b meckler , m suckow 1996",,sigmod conference,
1477,materialized view maintenance and integrity constraint checking : trading space for time 1996,"k ross , d srivastava , s sudarshan",sigmod conference,
1478,finding intensional knowledge of distance-based outliers vldb 1999,"e knorr , r ng",,
1479,"a novel index supporting high volume data warehouse insertion c jermaine , a datta , e omiecinski vldb",,,1999.0
1480,maintaining database consistency in presence of value dependencies in multidatabase systems sigmod conference 1996,"c morpain , m cart , j ferriщ , j pons",,
1481,rule languages and internal algebras for rule-based optimizers 1996,"m cherniack , s zdonik",sigmod conference,
1482,dynamic load balancing for parallel association rule mining on heterogenous pc cluster systems,"m tamura , m kitsuregawa",vldb,1999.0
1483,"a scalable and highly available networked database architecture r bamford , r ahad , a pruscino",,vldb,1999.0
1484,query execution techniques for caching expensive methods sigmod conference,"j hellerstein , j naughton",,1996.0
1485,"semi-automatic , self-adaptive control of garbage collection rates in object databases j cook , a klauser , a wolf , b zorn sigmod conference",,,1996.0
1486,context-based prefetch for implementing objects on relations vldb 1999,"p bernstein , s pal , d shutt",,
1487,towards effective and efficient free space management,"m mcauliffe , m carey , m solomon",sigmod conference,1996.0
1488,ghost : fine granularity buffering of indexes vldb 1999,"c goh , b ooi , d sim , k tan",,
1489,dbmss on a modern processor : where does time go ?,"a ailamaki , d dewitt , m hill , d wood",vldb,1999.0
1490,static detection of security flaws in object-oriented databases 1996,k tajima,sigmod conference,
1491,capturing and querying multiple aspects of semistructured data vldb,"c dyreson , m bіhlen , c jensen",,1999.0
1492,"multi-dimensional resource scheduling for parallel queries m garofalakis , y ioannidis sigmod conference 1996",,,
1493,safe and efficient sharing of persistent objects in thor sigmod conference,"b liskov , a adya , m castro , m day , s ghemawat , r gruber , u maheshwari , a myers , l shrira",,1996.0
1494,"cache conscious indexing for decision-support in main memory j rao , k ross",,vldb,1999.0
1495,comparing hierarchical data in external memory 1999,s chawathe,vldb,
1496,"an open storage system for abstract objects s blott , l relly , h schek sigmod conference",,,1996.0
1497,improved histograms for selectivity estimation of range predicates,"v poosala , y ioannidis , p haas , e shekita",sigmod conference,1996.0
1498,explaining differences in multidimensional aggregates 1999,s sarawagi,vldb,
1499,very large databases in a commercial application environment k hess vldb 1996,,,
1500,"database architecture optimized for the new bottleneck : memory access p boncz , s manegold , m kersten 1999",,vldb,
1501,"structures for manipulating proposed updates in object-oriented databases m doherty , r hull , m rupawalla sigmod conference",,,1996.0
1502,spatial hash-joins 1996,"m lo , c ravishankar",sigmod conference,
1503,active views for electronic commerce vldb 1999,"s abiteboul , b amann , s cluet , a eyal , l mignet , t milo",,
1504,"partition based spatial-merge join j patel , d dewitt sigmod conference 1996",,,
1505,"an adaptive hybrid server architecture for client caching odbmss k voruganti , m жzsu , r unrau 1999",,vldb,
1506,"implementing data cubes efficiently v harinarayan , a rajaraman , j ullman 1996",,sigmod conference,
1507,exploiting versions for handling updates in broadcast disks,"e pitoura , p chrysanthis",vldb,1999.0
1508,fast algorithms for maintaining replica consistency in lazy master replicated databases,"e pacitti , p minet , e simon",vldb,1999.0
1509,providing better support for a class of decision support queries,"s rao , a badia , d gucht",sigmod conference,1996.0
1510,"datablitz : a high performance main-memory storage manager j baulier , p bohannon , s gogate , s joshi , c gupta , a khivesera , h korth , p mcilroy , j miller , p narayan , m nemeth , r rastogi , a silberschatz , s sudarshan",,vldb,1998.0
1511,adapting materialized views after redefinitions sigmod conference,"a gupta , i mumick , k ross",,1995.0
1512,"bridging heterogeneity : research and practice of database middleware technology f rezende , g sauter 1998",,vldb,
1513,broadcast disks : data management for asymmetric communications environments sigmod conference,"s acharya , r alonso , m franklin , s zdonik",,1995.0
1514,heterogeneous database query optimization in db2 universal datajoiner,"s venkataraman , t zhang",vldb,1998.0
1515,an effective hash based algorithm for mining association rules sigmod conference,"j park , m chen , p yu",,1995.0
1516,"a database system for real-time event aggregation in telecommunication j baulier , s blott , h korth , a silberschatz",,vldb,1998.0
1517,"fastmap : a fast algorithm for indexing , data-mining and visualization of traditional and multimedia datasets c faloutsos , k lin",,sigmod conference,1995.0
1518,"dynamic resource brokering for multi-user query execution d davison , g graefe 1995",,sigmod conference,
1519,architecture of oracle parallel server,"r bamford , d butler , b klots , n macnaughton",vldb,1998.0
1520,checkpointing in oracle vldb 1998,"a joshi , w bridge , j loaiza , t lahiri",,
1521,"applying update streams in a soft real-time database system b adelberg , h garcia-molina , b kao 1995",,sigmod conference,
1522,"balancing histogram optimality and practicality for query result size estimation y ioannidis , v poosala sigmod conference",,,1995.0
1523,from data independence to knowledge independence : an on-going story vldb,l vieille,,1998.0
1524,dtl 's dataspot : database exploration using plain language,"s dar , g entin , s geva , e palmon",vldb,1998.0
1525,enhancing database correctness : a statistical approach sigmod conference 1995,"w hou , z zhang",,
1526,resource scheduling for composite multimedia objects vldb 1998,"m garofalakis , y ioannidis , b жzden",,
1527,"copy detection mechanisms for digital documents s brin , j davis , h garcia-molina sigmod conference 1995",,,
1528,"performance measurements of tertiary storage devices t johnson , e miller vldb 1998",,,
1529,a database interface for file updates sigmod conference,"s abiteboul , s cluet , t milo",,1995.0
1530,"incremental maintenance for materialized views over semistructured data s abiteboul , j mchugh , m rys , v vassalos , j wiener vldb",,,1998.0
1531,fault tolerant design of multimedia servers,"s berson , l golubchik , r muntz",sigmod conference,1995.0
1532,proximity search in databases 1998,"r goldman , n shivakumar , s venkatasubramanian , h garcia-molina",vldb,
1533,efficient maintenance of materialized mediated views sigmod conference,"j lu , g moerkotte , j schќ , v subrahmanian",,1995.0
1534,"carnot and infosleuth : database technology and the world wide web d woelk , w bohrer , n jacobs , k ong , c tomlinson , c unnikrishnan sigmod conference",,,1995.0
1535,technology and the future of commerce and finance ( abstract ) vldb,d shaw,,1998.0
1536,active storage for large-scale data mining and multimedia vldb,"e riedel , g gibson , c faloutsos",,1998.0
1537,high availability of commercial applications k ivinskis sigmod conference,,,1995.0
1538,enterprise transaction processing on windows nt g hope,,sigmod conference,1995.0
1539,a single pass computing engine for interactive analysis of vldbs t mihalisin,,vldb,1998.0
1540,dms : a parallel data mining server f george vldb,,,1998.0
1541,directv and oracle rdb : the challenges of vldb transaction processing w gettys 1995,,sigmod conference,
1542,"enterprise objects framework , a second generation object-relational enabler",c kleissner,sigmod conference,1995.0
1543,"low-cost compensation-based query processing и grјvlen , s hvasshovd , и torbjјrnsen vldb 1998",,,
1544,an overview of db2 parallel edition,"c baru , g fecteau , a goyal , h hsiao , a jhingran , s padmanabhan , w wilson",sigmod conference,1995.0
1545,a quantitative analysis and performance study for similarity-search methods in high-dimensional spaces,"r weber , h schek , s blott",vldb,1998.0
1546,data extraction and transformation for the data warehouse,c squire,sigmod conference,1995.0
1547,"reducing the braking distance of an sql query engine m carey , d kossmann 1998",,vldb,
1548,cover your assets m olson sigmod conference,,,1995.0
1549,querying continuous time sequences,"l lin , t risch",vldb,1998.0
1550,"recovery protocols for shared memory database systems l molesky , k ramamritham sigmod conference 1995",,,
1551,edgar f. codd : a tribute and personal memoir sigmod record 2003,c date,,
1552,nd-sql : a multi-dimensional language for interoperability and olap vldb 1998,"f gingras , l lakshmanan",,
1553,the lyric language : querying constraint objects sigmod conference,"a brodsky , y kornatzky",,1995.0
1554,"the heterogeneity problem and middleware technology : experiences with and performance of database gateways f rezende , k hergula vldb",,,1998.0
1555,"evaluating functional joins along nested reference sets in object-relational and object-oriented databases r braumandl , j clauпen , a kemper vldb 1998",,,
1556,datamine - interactive rule discovery system,"t imielinski , a virmani",sigmod conference,1995.0
1557,"using schema matching to simplify heterogeneous data translation t milo , s zohar",,vldb,1998.0
1558,efendi : federated database system of cadlab sigmod conference,"e radeke , r bіttger , b burkert , y engel , g kachel , s kolmschlag , d nolte",,1995.0
1559,nearest neighbor queries 1995,"n roussopoulos , s kelley , f vincent",sigmod conference,
1560,on optimal node splitting for r-trees vldb 1998,"y garcэa , m lopez , s leutenegger",,
1561,"r-tree based indexing of now-relative bitemporal data r bliujute , c jensen , s saltenis , g slivinskas vldb",,,1998.0
1562,topological relations in the world of minimum bounding rectangles : a study with r-trees sigmod conference,"d papadias , y theodoridis , t sellis , m egenhofer",,1995.0
1563,"towards an effective calculus for object query languages l fegaras , d maier 1995",,sigmod conference,
1564,"optimal histograms with quality guarantees h jagadish , n koudas , s muthukrishnan , v poosala , k sevcik , t suel",,vldb,1998.0
1565,"ofl : a functional execution model for object query languages g gardarin , f machuca , p pucheral sigmod conference 1995",,,
1566,"incremental clustering for mining in a data warehousing environment m ester , h kriegel , j sander , m wimmer , x xu vldb 1998",,,
1567,"inferring function semantics to optimize queries m cherniack , s zdonik",,vldb,1998.0
1568,oodb indexing by class-division,"s ramaswamy , p kanellakis",sigmod conference,1995.0
1569,the handwritten trie : indexing electronic ink sigmod conference 1995,"w aref , d barbarс , p vallabhaneni",,
1570,"topaz : a cost-based , rule-driven , multi-phase parallelizer c nippl , b mitschang",,vldb,1998.0
1571,"improving adaptable similarity query processing by using approximations m ankerst , b braunmќller , h kriegel , t seidl",,vldb,1998.0
1572,"parallel evaluation of multi-join queries a wilschut , j flokstra , p apers 1995",,sigmod conference,
1573,mindreader : querying databases through multiple examples,"y ishikawa , r subramanya , c faloutsos",vldb,1998.0
1574,"the merge/purge problem for large databases m hernсndez , s stolfo",,sigmod conference,1995.0
1575,semantic assumptions and query evaluation in temporal databases sigmod conference 1995,"c bettini , x wang , e bertino , s jajodia",,
1576,"what do those weird xml types want , anyway ? vldb",s derose,,1999.0
1577,"online dynamic reordering for interactive data processing v raman , b raman , j hellerstein 1999",,vldb,
1578,implementing crash recovery in quickstore : a performance study,"s white , d dewitt",sigmod conference,1995.0
1579,hyper-programming in java,"e zirintsis , g kirby , r morrison",vldb,1999.0
1580,"reducing multidatabase query response time by tree balancing w du , m shan , u dayal sigmod conference 1995",,,
1581,"industrial panel on data warehousing technologies : experiences , challenges , and directions u dayal 1999",,vldb,
1582,temporal conditions and integrity constraints in active database systems sigmod conference,"a sistla , o wolfson",,1995.0
1583,"pm3 : an orthogonal persistent systems programming language - design , implementation , performance a hosking , j chen 1999",,vldb,
1584,view maintenance in a warehousing environment,"y zhuge , h garcia-molina , j hammer , j widom",sigmod conference,1995.0
1585,"implementation of sql3 structured types with inheritance and value substitutability y fuh , s deпloch , w chen , n mattos , b tran , b lindsay , l demichel , s rielau , d mannhaupt",,vldb,1999.0
1586,"hypergraph based reorderings of outer join queries with complex predicates g bhargava , p goel , b iyer",,sigmod conference,1995.0
1587,"the spiffi scalable video-on-demand system c freedman , d dewitt",,sigmod conference,1995.0
