id,title,authors,venue,year
1820,query by diagram : a graphical environment for querying databases 1994,"t catarci , g santucci",sigmod conference,
1821,extracting large data sets using db2 parallel edition vldb 1996,s padmanabhan,,
1822,"quest : a project on database mining r agrawal , m carey , c faloutsos , s ghosh , m houtsma , t imielinski , b iyer , a mahboob , h miranda , r srikant , a swami 1994",,sigmod conference,
1823,"metu object-oriented dbms a dogac , i arpinar , c evrendilek , c ozkan , i altintas , i durusoy , m altinel , t okay , y saygin 1994",,sigmod conference,
1824,"further improvements on integrity constraint checking for stratifiable deductive databases s lee , t ling vldb 1996",,,
1825,"estimation of query-result distribution and its application in parallel-join load balancing v poosala , y ioannidis vldb 1996",,,
1826,"xsb as a deductive database k sagonas , t swift , d warren sigmod conference 1994",,,
1827,"power efficient data gathering and aggregation in wireless sensor networks h tan , i korpeoglu",,sigmod record,2003.0
1828,to weave the web vldb 1997,"p atzeni , g mecca , p merialdo",,
1829,multimedia streaming in large-scale sensor networks with mobile swarms 2003,"m gerla , k xu",sigmod record,
1830,"using probabilistic information in data integration d florescu , d koller , a levy vldb 1997",,,
1831,reasoning on regular path queries 2003,"d calvanese , g giacomo , m lenzerini , m vardi",sigmod record,
1832,on-demand data elevation in hierarchical multimedia storage servers vldb,"p triantafillou , t papadakis",,1997.0
1833,interview with pat selinger 2003,,,
1834,principles of optimally placing data in tertiary storage libraries vldb 1997,"s christodoulakis , p triantafillou , f zioga",,
1835,reminiscences on influential papers,,,2003.0
1836,materialized views selection in a multidimensional database vldb 1997,"e baralis , s paraboschi , e teniente",,
1837,"parallel algorithms for high-dimensional similarity joins for data mining applications j shafer , r agrawal vldb 1997",,,
1838,sting : a statistical information grid approach to spatial data mining vldb,"w wang , j yang , r muntz",,1997.0
1839,"review of data on the web : from relational to semistructured data and xml by serge abiteboul , peter buneman , and dan suciu . morgan kaufmann 1999",,,2003.0
1840,"merging ranks from heterogeneous internet sources l gravano , h garcia-molina vldb",,,1997.0
1841,"energy and rate based mac protocol for wireless sensor networks r kannan , r kalidindi , s iyengar , v kumar 2003",,sigmod record,
1842,"the case for enhanced abstract data types p seshadri , m livny , r ramakrishnan vldb 1997",,,
1843,"integrating reliable memory in databases w ng , p chen 1997",,vldb,
1844,distributed deviation detection in sensor networks,"t palpanas , d papadopoulos , v kalogeraki , d gunopulos",sigmod record,2003.0
1845,"logical and physical versioning in main memory databases r rastogi , s seshadri , p bohannon , d leinbaugh , a silberschatz , s sudarshan 1997",,vldb,
1846,book review column sigmod record,k aberer,,2003.0
1847,sensor : the atomic computing particle v kumar 2003,,sigmod record,
1848,"using versions in update transactions : application to integrity checking f llirbat , e simon , d tombroff vldb 1997",,,
1849,incremental organization for data recording and warehousing,"h jagadish , p narayan , s seshadri , s sudarshan , r kanneganti",vldb,1997.0
1850,"the sensor spectrum : technology , trends , and requirements j hellerstein , w hong , s madden",,sigmod record,2003.0
1851,understanding the semantics of sensor data m mani,,sigmod record,2003.0
1852,multiple-view self-maintenance in data warehousing environments n huyn 1997,,vldb,
1853,"recovering information from summary data c faloutsos , h jagadish , n sidiropoulos 1997",,vldb,
1854,"managing uncertainty in sensor database r cheng , s prabhakar sigmod record",,,2003.0
1855,implementing abstract objects with inheritance in datalogneg vldb 1997,h jamil,,
1856,the cougar project : a work-in-progress report 2003,"a demers , j gehrke , r rajaraman , a trigoni , y yao",sigmod record,
1857,dbglobe : a service-oriented p2p system for global computing,"e pitoura , s abiteboul , d pfoser , g samaras , m vazirgiannis",sigmod record,2003.0
1858,mining insurance data at swiss life vldb 1997,"j kietz , u reimer , m staudt",,
1859,facilitating multimedia database exploration through visual interfaces and perpetual query reformulations 1997,"w li , k candan , k hirata , y hara",vldb,
1860,toward network data independence j hellerstein sigmod record 2003,,,
1861,"design issues and challenges for rdf - and schema-based peer-to-peer systems w nejdl , w siberski , m sintek sigmod record 2003",,,
1862,treasurer 's message,,,2003.0
1863,the oracle universal server buffer,"w bridge , a joshi , m keihl , t lahiri , j loaiza , n macnaughton",vldb,1997.0
1864,chair 's message 2003,,,
1865,"the network as a global database : challenges of interoperability , proactivity , interactiveness , legacy p lockemann , u kіlsch , a koschel , r kramer , r nikolai , m wallrath , h walter",,vldb,1997.0
1866,"selectivity estimation without the attribute value independence assumption v poosala , y ioannidis",,vldb,1997.0
1867,journal relevance r snodgrass,,sigmod record,2003.0
1868,"towards an odmg-compliant visual object query language m chavda , p wood 1997",,vldb,
1869,guest editor 's introduction,,,2003.0
1870,integrating sql databases with content-specific search engines 1997,"s deпloch , n mattos",vldb,
1871,"resource scheduling in enhanced pay-per-view continuous media databases m garofalakis , b жzden , a silberschatz 1997",,vldb,
1872,learning about data integration challenges from day one a halevy 2003,,sigmod record,
1873,"spatial joins using r-trees : breadth-first traversal with global optimizations y huang , n jing , e rundensteiner",,vldb,1997.0
1874,agent-oriented software engineering report on the 4th aose workshop ( aose 2003 ) 2003,,,
1875,the complexity of transformation-based join enumeration 1997,"a pellenkoft , c galindo-legaria , m kersten",vldb,
1876,report on the 5th international workshop on the design and management of data warehouses ( dmdw ' 03 ) 2003,,,
1877,"using taxonomy , discriminants , and signatures for navigating in text databases s chakrabarti , b dom , r agrawal , p raghavan",,vldb,1997.0
1878,"information integration on the web : a view from ai and databases ( report on iiweb-03 ) s kambhampati , c knoblock sigmod record",,,2003.0
1879,report on fqas 2002 : fifth international conference on flexible query answering systems 2003,,,
1880,m-tree : an efficient access method for similarity search in metric spaces 1997,"p ciaccia , m patella , p zezula",vldb,
1881,optimizing queries across diverse data sources vldb 1997,"l haas , d kossmann , e wimmers , j yang",,
1882,editor 's notes l liu sigmod record 2003,,,
1883,vertical data migration in large near-line document archives based on markov-chain predictions,"a kraiss , g weikum",vldb,1997.0
1884,research in database engineering at the university of namur j hainaut,,sigmod record,2003.0
1885,"exposing undergraduate students to database system internals a ailamaki , j hellerstein sigmod record 2003",,,
1886,"parallel query scheduling and optimization with time - and space-shared resources m garofalakis , y ioannidis vldb 1997",,,
1887,"analysis of sigmod 's co-authorship graph m nascimento , j sander , j pound sigmod record 2003",,,
1888,"optimizing queries with universal quantification in object-oriented and object-relational databases j clauпen , a kemper , g moerkotte , k peithner vldb",,,1997.0
1889,a performance evaluation of oid mapping techniques vldb 1995,"a eickler , c gerlhof , d kossmann",,
1890,editor 's notes,l liu,sigmod record,2003.0
1891,"efficient incremental garbage collection for client-server object database systems l amsaleg , m franklin , o gruber vldb 1995",,,
1892,closing the key loophole in mls databases,"n jukic , s nestorov , s vrbsky",sigmod record,2003.0
1893,report on the 4th international conference on mobile data management,,,2003.0
1894,document management as a database problem r bayer vldb,,,1995.0
1895,from vldb to vmldb ( very many large data bases ) : dealing with large-scale semantic heterogenity s madnick 1995,,vldb,
1896,"declustering databases on heterogeneous disk systems l chen , d rotem , s seshadri",,vldb,1995.0
1897,"standards for databases on the grid s malaika , a eisenberg , j melton",,sigmod record,2003.0
1898,"review of the data warehouse toolkit : the complete guide to dimensional modeling ( 2nd edition ) by ralph kimball , margy ross . john wiley & sons , inc. 2002",,,2003.0
1899,high-concurrency locking in r-trees vldb 1995,"m kornacker , d banks",,
1900,"duplicate removal in information system dissemination t yan , h garcia-molina vldb 1995",,,
1901,interview with rakesh agrawal 2003,,,
1902,reminiscences on influential papers,,,2003.0
1903,"generalizing gloss to vector-space databases and broker hierarchies l gravano , h garcia-molina 1995",,vldb,
1904,in-context peer-to-peer information filtering on the web a ouksel,,sigmod record,2003.0
1905,tribeca : a stream database manager for network traffic analysis vldb,m sullivan,,1996.0
1906,selective information dissemination in p2p networks : problems and solutions 2003,"m koubarakis , c tryfonopoulos , s idreos , y drougas",sigmod record,
1907,mineset ( tm ) : a system for high-end data mining and visualization 1996,,vldb,
1908,the query optimizer in tandem 's new serverware sql product,p celis,vldb,1996.0
1909,the hyperion project : from data integration to data coordination sigmod record 2003,"m arenas , v kantere , a kementsietsidis , i kiringa , r miller , j mylopoulos",,
1910,"tpc-d : the challenges , issues and results r bhashyam vldb",,,1996.0
1911,relational data sharing in peer-based data management systems,"b ooi , y shu , k tan",sigmod record,2003.0
1912,performance of future database systems : bottlenecks and bonananzas vldb 1996,c baru,,
1913,"what is the data warehousing problem ? ( are materialized views the answer ? ) a gupta , i mumick 1996",,vldb,
1914,the piazza peer data management project 2003,"i tatarinov , z ives , j madhavan , a halevy , d suciu , n dalvi , x dong , y kadiyska , g miklau , p mork",sigmod record,
1915,peer-to-peer research at stanford 2003,"m bawa , b cooper , a crespo , n daswani , p ganesan , h garcia-molina , s kamvar , s marti , m schlosser , q sun , p vinograd , b yang",sigmod record,
1916,the structured information manager : a database system for sgml documents vldb 1996,r sacks-davis,,
1917,loading the data warehouse across various parallel architectures 1996,v raghavan,vldb,
1918,p-grid : a self-organizing structured p2p system,"k aberer , p cudrщ-mauroux , a datta , z despotovic , m hauswirth , m punceva , r schmidt",sigmod record,2003.0
1919,"report on the 10th conference on database systems for business , technology , and the web ( btw 2003 )",,,2003.0
1920,"an efficient algorithm for mining association rules in large databases a savasere , e omiecinski , s navathe",,vldb,1995.0
1921,"discovery of multiple-level association rules from large databases j han , y fu 1995",,vldb,
1922,reminiscences on influential papers,,,2003.0
1923,"a mapping mechanism to support bitmap index and other auxiliary structures on tables stored as primary b + - trees e chong , j srinivasan , s das , c freiwald , a yalamanchi , m jagannath , a tran , r krishnan , r jiang 2003",,sigmod record,
1924,dynamic multi-resource load balancing in parallel database systems vldb,"e rahm , r marek",,1995.0
1925,interview with michael stonebraker,,,2003.0
1926,a non-uniform data fragmentation strategy for parallel main-menory database systems 1995,"n bassiliades , i vlahavas",vldb,
1927,information rules,d stirling,sigmod record,2003.0
1928,"applying database technology in the adsm mass storage system l cabrera , r rees , w hineman vldb 1995",,,
1929,peer-to-peer : harnessing the power of disruptive technologies m nascimento 2003,,sigmod record,
1930,"generalized search trees for database systems j hellerstein , j naughton , a pfeffer",,vldb,1995.0
1931,fundamentals of data warehouses : 2nd revised and extended edition,v hoffner,sigmod record,2003.0
1932,"a scalable architecture for autonomous heterogeneous database interactions s milliner , a bouguettaya , m papazoglou vldb 1995",,,
1933,"fast similarity search in the presence of noise , scaling , and translation in time-series databases r agrawal , k lin , h sawhney , k shim 1995",,vldb,
1934,towards a database body of knowledge : a study from spain 2003,"c calero , m piattini , f ruiz",sigmod record,
1935,research issues for data communication in mobile ad-hoc network database systems sigmod record,"l fife , l gruenwald",,2003.0
1936,"coloring away communication in parallel query optimization w hasan , r motwani 1995",,vldb,
1937,bypassing joins in disjunctive queries,"m steinbrunn , k peithner , g moerkotte , a kemper",vldb,1995.0
1938,modelling temporal thematic map contents sigmod record,"a d'onofrio , e pourabbas",,2003.0
1939,xpath processing in a nutshell 2003,,,
1940,a practical and modular implementation of extended transaction models vldb,"r barga , c pu",,1995.0
1941,"a data transformation system for biological data sources p buneman , s davidson , k hart , g overton , l wong vldb 1995",,,
1942,issues in data stream management sigmod record 2003,"l golab , m жzsu",,
1943,chair 's message,,,2003.0
1944,"aggregate-query processing in data warehousing environments a gupta , v harinarayan , d quass vldb 1995",,,
1945,a web odyssey : from codd to xml v vianu,,sigmod record,2003.0
1946,eager aggregation and lazy aggregation vldb 1995,"w yan , p larson",,
1947,book review column k aberer 2003,,sigmod record,
1948,a cost model for clustered object-oriented databases vldb,"g gardarin , j gruser , z tang",,1995.0
1949,"estimating the selectivity of spatial queries using the ` correlation ' fractal dimension a belussi , c faloutsos vldb",,,1995.0
1950,"an approach to confidence based page ranking for user oriented web search d mukhopadhyay , d giri , s singh sigmod record 2003",,,
1951,acm tods in this internet age r snodgrass,,sigmod record,2003.0
1952,"zoo : a desktop experiment management environment y ioannidis , m livny , s gupta , n ponnekanti",,vldb,1996.0
1953,"querying multiple features of groups in relational databases d chatziantoniou , k ross 1996",,vldb,
1954,performing jobs without decompression in a compressed database system,"s o'connell , n winterbottom",sigmod record,2003.0
1955,modeling skewed distribution using multifractals and the ` 80-20 ' law,"c faloutsos , y matias , a silberschatz",vldb,1996.0
1956,xpath processing in a nutshell sigmod record,"g gottlob , c koch , r pichler",,2003.0
1957,"semantic data caching and replacement s dar , m franklin , b jѓnsson , d srivastava , m tan 1996",,vldb,
1958,interview with jim gray 2003,,,
1959,a database approach to quality of service specification in video databases,"e bertino , a elmagarmid , m hacid",sigmod record,2003.0
1960,implementation and analysis of a parallel collection query language d suciu vldb 1996,,,
1961,ansi sql hierarchical processing can fully integrate native xml m david sigmod record,,,2003.0
1962,obtaining complete answers from incomplete databases a levy 1996,,vldb,
1963,"object fusion in mediator systems y papakonstantinou , s abiteboul , h garcia-molina 1996",,vldb,
1964,"analysis of existing databases at the logical level : the dba companion project f marchi , s lopes , j petit , f toumani 2003",,sigmod record,
1965,"database research at ut arlington s chakravarthy , y aslandogan , r elmasri , l fegaras , j oh",,sigmod record,2003.0
1966,the role of integrity constraints in database interoperation 1996,"m vermeer , p apers",vldb,
1967,multiscale histograms : summarizing topological relations in large spatial datasets vldb 2003,"x lin , q liu , y yuan , x zhou",,
1968,"query processing in spatial network databases d papadias , j zhang , n mamoulis , y tao",,vldb,2003.0
1969,merging models based on given correspondences,"r pottinger , p bernstein",vldb,2003.0
1970,"avoiding ordering and grouping in query processing x wang , m cherniack vldb 2003",,,
1971,"anipqo : almost non-intrusive parametric query optimization for nonlinear cost functions a hulgeri , s sudarshan 2003",,vldb,
1972,"supporting top-k join queries in relational databases i ilyas , w aref , a elmagarmid 2003",,vldb,
1973,the tpr * - tree : an optimized spatio-temporal access method for predictive queries vldb,"y tao , d papadias , j sun",,2003.0
1974,"efficient approximation of optimization queries under parametric aggregation constraints s guha , d gunopulos , n koudas , d srivastava , m vlachos 2003",,vldb,
1975,cache tables : paving the way for an adaptive database cache 2003,"m altinel , c bornhіvd , s krishnamurthy , c mohan , h pirahesh , b reinwald",vldb,
1976,lachesis : robust database storage management based on device-specific performance characteristics vldb 2003,"j schindler , a ailamaki , g ganger",,
1977,a dependability benchmark for oltp application environments vldb 2003,"m vieira , h madeira",,
1978,primitives for workload summarization and implications for sql 2003,"s chaudhuri , p ganesan , v narasayya",vldb,
1979,bhunt : automatic discovery of fuzzy algebraic constraints in relational data vldb 2003,"p brown , p haas",,
1980,"estimating the output cardinality of partial preaggregation with a measure of clusteredness s helmer , t neumann , g moerkotte 2003",,vldb,
1981,memory requirements for query execution in highly constrained devices vldb 2003,"n anciaux , l bouganim , p pucheral",,
1982,tabular placement of relational data on mems-based storage devices vldb 2003,"h yu , d agrawal , a abbadi",,
1983,capturing global transactions from multiple recovery log files in a partitioned database system 2003,"c liu , b lindsay , s bourbonnais , e hamel , t truong , j stankiewitz",vldb,
1984,the bea/xqrl streaming xquery processor vldb,"d florescu , c hillery , d kossmann , p lucas , f riccardi , t westmann , m carey , a sundararajan , g agrawal",,2003.0
1985,"xml schemas in oracle xml db r murthy , s banerjee",,vldb,2003.0
1986,integrated data management for mobile services in the real world vldb 2003,"c hage , c jensen , t pedersen , l speicys , i timko",,
1987,"improving performance with bulk-inserts in oracle r-trees n an , k kanth , s ravada vldb 2003",,,
1988,"statistics on views c galindo-legaria , m joshi , f waas , m wu vldb 2003",,,
1989,"efficient query processing for multi-dimensionally clustered tables in db2 b bhattacharjee , s padmanabhan , t malkemus , t lai , l cranston , m huras",,vldb,2003.0
1990,a platform based on the multi-dimensional data model for analysis of bio-molecular structures vldb 2003,"s srinivasa , s kumar",,
1991,controlling access to published data using cryptography vldb,"g miklau , d suciu",,2003.0
1992,"oasis : an online and accurate technique for local-alignment searches on biological sequences c meek , j patel , s kasetty vldb 2003",,,
1993,privacy-preserving indexing of documents on the network 2003,"m bawa , r jr. , r agrawal",vldb,
1994,data compression in oracle 2003,"m pіss , d potapov",vldb,
1995,operator scheduling in a data stream manager 2003,"d carney , u чetintemel , a rasin , s zdonik , m cherniack , m stonebraker",vldb,
1996,"efficient ir-style keyword search over relational databases v hristidis , l gravano , y papakonstantinou 2003",,vldb,
1997,locating data sources in large distributed systems vldb,"l galanis , y wang , s jeffery , d dewitt",,2003.0
1998,robust estimation with sampling and approximate pre-aggregation c jermaine,,vldb,2003.0
1999,"chameleon : an extensible and customizable tool for web data translation r torlone , p atzeni",,vldb,2003.0
2000,webservice composition with o'grape and osiris vldb 2003,"r weber , c schuler , p neukomm , h schuldt , h schek",,
2001,implementing xquery 1.0 : the galax experience vldb 2003,"m fernandez , j simщon , b choi , a marian , g sur",,
2002,a system for keyword proximity search on xml databases vldb 2003,"a balmin , v hristidis , n koudas , y papakonstantinou , d srivastava , t wang",,
2003,"xquec : pushing queries to compressed xml data a arion , a bonifati , g costa , s d'aguanno , i manolescu , a pugliese vldb",,,2003.0
2004,"managing distributed workspaces with active xml s abiteboul , j baumgarten , a bonifati , g cobena , c cremarenco , f dragan , i manolescu , t milo , n preda",,vldb,2003.0
2005,orientstore : a schema based native xml storage system 2003,"x meng , d luo , m lee , j an",vldb,
2006,"xcerpt and visxcerpt : from pattern-based to visual querying of xml and semistructured data s berger , f bry , s schaffert , c wieser",,vldb,2003.0
2007,illuminating the dark side of web services,m brodie,vldb,2003.0
2008,who needs xml databases ? vldb 2003,s cluet,,
2009,"a database striptease or how to manage your personal databases m kersten , g weikum , m franklin , d keim , a buchmann , s chaudhuri vldb 2003",,,
2010,the zero-delay data warehouse : mobilizing heterogeneous databases vldb 2003,e kќhn,,
2011,commercial use of database technology h schіning,,vldb,2003.0
2012,grid and applications ( industrial session ) vldb 2003,f leymann,,
2013,web services ( industrial session ) f cabrera,,vldb,2003.0
2014,privacy-enhanced data management for next-generation e-commerce 2003,,,
2015,the semantic web : semantics for data on the web 2003,,,
2016,"irisnet : an architecture for internet-scale sensing services s nath , a deshpande , y ke , p gibbons , b karp , s seshan vldb 2003",,,
2017,"large-scale , standards-based earth observation imagery and web mapping services p baumann vldb",,,2003.0
2018,"quiet : continuous query-driven index tuning k sattler , i geist , e schallehn vldb 2003",,,
2019,"chip-secured data access : reconciling access rights with data encryption l bouganim , f ngoc , p pucheral , l wu vldb",,,2003.0
2020,"an interpolated volume data model t wang , s santini , a gupta",,vldb,2003.0
2021,efficacious data cube exploration by semantic summarization and compression,"l lakshmanan , j pei , y zhao",vldb,2003.0
2022,"atlas : a small but complete sql extension for data mining and data streams h wang , c zaniolo , c luo",,vldb,2003.0
2023,business modelling using sql spreadsheets,"a witkowski , s bellamkonda , t bozkaya , n folkert , a gupta , l sheng , s subramanian",vldb,2003.0
2024,from focused crawling to expert information : an application framework for web exploration and portal generation vldb 2003,"s sizov , j graupmann , m theobald",,
2025,cacheportal ii : acceleration of very large scale data center-hosted database-driven web applications vldb 2003,"w li , o po , w hsiung , k candan , d agrawal , y akca , k taniguchi",,
2026,"bibfinder/statminer : effectively mining and using coverage and overlap statistics in data integration z nie , s kambhampati , t hernandez vldb 2003",,,
2027,"s-topss : semantic toronto publish/subscribe system m petrovic , i burcea , h jacobsen 2003",,vldb,
2028,"nexusscout : an advanced location-based application on a distributed , open mediation platform vldb 2003","d nicklas , m groпmann , t schwarz",,
2029,"schema-driven customization of web services s abiteboul , b amann , j baumgarten , o benjelloun , f ngoc , t milo",,vldb,2003.0
2030,integrating information for on demand computing n mattos vldb,,,2003.0
2031,"a nanotechnology-based approach to data storage e eleftheriou , p bфchtold , g cherubini , a dholakia , c hagleitner , t loeliger , a pantazi , h pozidis , t albrecht , g binnig , m despont , u drechsler , u dќrig , b gotsmann , d jubin , w hфberle , m lantz , h rothuizen , r stutz , p vettiger , d wiesmann",,vldb,2003.0
2032,the history of histograms ( abridged ) y ioannidis vldb 2003,,,
2033,the data-centric revolution in networking,s shenker,vldb,2003.0
2034,"xsearch : a semantic search engine for xml s cohen , j mamou , y kanza , y sagiv",,vldb,2003.0
2035,complex queries over web repositories vldb 2003,"s raghavan , h garcia-molina",,
2036,efficient mining of xml query patterns for caching,"l yang , m lee , w hsu",vldb,2003.0
2037,an efficient and resilient approach to filtering and disseminating streaming data vldb 2003,"s shah , s dharmarajan , k ramamritham",,
2038,phrase matching in xml vldb,"s amer-yahia , m fernandez , d srivastava , y xu",,2003.0
2039,rrxf : redundancy reducing xml storage in relations vldb,"y chen , s davidson , c hara , y zheng",,2003.0
2040,"mars : a system for publishing xml from mixed and redundant storage a deutsch , v tannen vldb 2003",,,
2041,projecting xml documents 2003,"a marian , j simщon",vldb,
2042,mixed mode xml query processing vldb,"a halverson , j burger , l galanis , a kini , r krishnamurthy , a rao , f tian , s viglas , y wang , j naughton , d dewitt",,2003.0
2043,from tree patterns to generalized tree patterns : on efficient evaluation of xquery vldb 2003,"z chen , h jagadish , l lakshmanan , s paparizos",,
2044,efficient processing of expressive node-selecting queries on xml data in secondary storage : a tree automata-based approach c koch vldb 2003,,,
2045,query processing for high-volume xml message brokering 2003,"y diao , m franklin",vldb,
2046,"a framework for clustering evolving data streams c aggarwal , j han , j wang , p yu vldb 2003",,,
2047,"a regression-based temporal pattern mining scheme for data streams w teng , m chen , p yu 2003",,vldb,
2048,on the costs of multilingualism in database systems 2003,"a kumaran , j haritsa",vldb,
2049,distributed top-n query processing with possibly uncooperative local systems vldb 2003,"c yu , g philip , w meng",,
2050,"optimized query execution in large search engines with global page ordering x long , t suel",,vldb,2003.0
